ID_TERRITORIO,CODIGO,ID_NIVEL_TERRITORIAL,DESCRIPCION,ID_TERRITORIO_PADRE,PATH_DESCRIPCION,PATH_ID,PATH_CODIGO,NOMECLATURA,PATH_NOMECLATURA
1216,52,5,MATUS,358,"ECUADOR CHIMBORAZO PENIPE MATUS","1,7,358,1216","593 06 09 52",MAT,"EC CHI PEN MAT"
1217,53,5,PUELA,358,"ECUADOR CHIMBORAZO PENIPE PUELA","1,7,358,1217","593 06 09 53",PUE,"EC CHI PEN PUE"
1218,54,5,"SAN ANTONIO DE BAYUSHIG",358,"ECUADOR CHIMBORAZO PENIPE SAN ANTONIO DE BAYUSHIG","1,7,358,1218","593 06 09 54",SAN,"EC CHI PEN SAN"
1219,55,5,"LA CANDELARIA",358,"ECUADOR CHIMBORAZO PENIPE LA CANDELARIA","1,7,358,1219","593 06 09 55",LAC,"EC CHI PEN LAC"
1220,56,5,"BILBAO (CAB.EN QUILLUYACU)",358,"ECUADOR CHIMBORAZO PENIPE BILBAO (CAB.EN QUILLUYACU)","1,7,358,1220","593 06 09 56",BIL,"EC CHI PEN BIL"
1221,50,8,"CUMANDÁ, CABECERA CANTONAL",359,"ECUADOR CHIMBORAZO CUMANDÁ CUMANDÁ, CABECERA CANTONAL","1,7,359,1221","593 06 10 50",CUM,"EC CHI CUM CUM"
1222,50,8,"MACHALA, CABECERA CANTONAL Y CAPITAL PROVINCIAL",400,"ECUADOR EL ORO MACHALA MACHALA, CABECERA CANTONAL Y CAPITAL PROVINCIAL","1,8,400,1222","593 07 01 50",MAC,"EC EOR MAC MAC"
1223,01,4,"LA PROVIDENCIA",400,"ECUADOR EL ORO MACHALA LA PROVIDENCIA","1,8,400,1223","593 07 01 01",LAP,"EC EOR MAC LAP"
1224,02,4,MACHALA,400,"ECUADOR EL ORO MACHALA MACHALA","1,8,400,1224","593 07 01 02",MAC,"EC EOR MAC MAC"
1225,03,4,"PUERTO BOLÍVAR",400,"ECUADOR EL ORO MACHALA PUERTO BOLÍVAR","1,8,400,1225","593 07 01 03",PUE,"EC EOR MAC PUE"
1226,04,4,"NUEVE DE MAYO",400,"ECUADOR EL ORO MACHALA NUEVE DE MAYO","1,8,400,1226","593 07 01 04",NUE,"EC EOR MAC NUE"
1227,05,4,"EL CAMBIO (URBANA)",400,"ECUADOR EL ORO MACHALA EL CAMBIO","1,8,400,1227","593 07 01 05",ELC,"EC EOR MAC ELC"
1228,52,5,"EL RETIRO",400,"ECUADOR EL ORO MACHALA EL RETIRO","1,8,400,1228","593 07 01 52",ELR,"EC EOR MAC ELR"
1229,50,8,"ARENILLAS, CABECERA CANTONAL",401,"ECUADOR EL ORO ARENILLAS ARENILLAS, CABECERA CANTONAL","1,8,401,1229","593 07 02 50",ARE,"EC EOR ARE ARE"
1230,51,5,CHACRAS,401,"ECUADOR EL ORO ARENILLAS CHACRAS","1,8,401,1230","593 07 02 51",CHA,"EC EOR ARE CHA"
1231,54,5,PALMALES,401,"ECUADOR EL ORO ARENILLAS PALMALES","1,8,401,1231","593 07 02 54",PAL,"EC EOR ARE PAL"
1232,55,5,CARCABÓN,401,"ECUADOR EL ORO ARENILLAS CARCABÓN","1,8,401,1232","593 07 02 55",CAR,"EC EOR ARE CAR"
1233,50,8,"PACCHA, CABECERA CANTONAL",402,"ECUADOR EL ORO ATAHUALPA PACCHA, CABECERA CANTONAL","1,8,402,1233","593 07 03 50",PAC,"EC EOR ATA PAC"
1234,51,5,AYAPAMBA,402,"ECUADOR EL ORO ATAHUALPA AYAPAMBA","1,8,402,1234","593 07 03 51",AYA,"EC EOR ATA AYA"
1235,52,5,CORDONCILLO,402,"ECUADOR EL ORO ATAHUALPA CORDONCILLO","1,8,402,1235","593 07 03 52",COR,"EC EOR ATA COR"
1236,53,5,MILAGRO,402,"ECUADOR EL ORO ATAHUALPA MILAGRO","1,8,402,1236","593 07 03 53",MIL,"EC EOR ATA MIL"
1237,54,5,"SAN JOSÉ",402,"ECUADOR EL ORO ATAHUALPA SAN JOSÉ","1,8,402,1237","593 07 03 54",SAN,"EC EOR ATA SAN"
1238,55,5,"SAN JUAN DE CERRO AZUL",402,"ECUADOR EL ORO ATAHUALPA SAN JUAN DE CERRO AZUL","1,8,402,1238","593 07 03 55",SAN,"EC EOR ATA SAN"
1239,50,8,"BALSAS, CABECERA CANTONAL",403,"ECUADOR EL ORO BALSAS BALSAS, CABECERA CANTONAL","1,8,403,1239","593 07 04 50",BAL,"EC EOR BAL BAL"
1240,51,5,BELLAMARÍA,403,"ECUADOR EL ORO BALSAS BELLAMARÍA","1,8,403,1240","593 07 04 51",BEL,"EC EOR BAL BEL"
1241,50,8,"CHILLA, CABECERA CANTONAL",404,"ECUADOR EL ORO CHILLA CHILLA, CABECERA CANTONAL","1,8,404,1241","593 07 05 50",CHI,"EC EOR CHI CHI"
1242,50,8,"EL GUABO, CABECERA CANTONAL",405,"ECUADOR EL ORO EL GUABO EL GUABO, CABECERA CANTONAL","1,8,405,1242","593 07 06 50",ELG,"EC EOR EGU ELG"
1243,51,5,"BARBONES (SUCRE) ",405,"ECUADOR EL ORO EL GUABO BARBONES (SUCRE) ","1,8,405,1243","593 07 06 51",BAR,"EC EOR EGU BAR"
1244,52,5,"LA IBERIA",405,"ECUADOR EL ORO EL GUABO LA IBERIA","1,8,405,1244","593 07 06 52",LAI,"EC EOR EGU LAI"
1245,53,5,"TENDALES (CAB.EN PUERTO TENDALES)",405,"ECUADOR EL ORO EL GUABO TENDALES (CAB.EN PUERTO TENDALES)","1,8,405,1245","593 07 06 53",TEN,"EC EOR EGU TEN"
1246,54,5,"RÍO BONITO",405,"ECUADOR EL ORO EL GUABO RÍO BONITO","1,8,405,1246","593 07 06 54",RÍO,"EC EOR EGU RÍO"
1247,50,8,"HUAQUILLAS, CABECERA CANTONAL",406,"ECUADOR EL ORO HUAQUILLAS HUAQUILLAS, CABECERA CANTONAL","1,8,406,1247","593 07 07 50",HUA,"EC EOR HUA HUA"
1248,01,4,ECUADOR,406,"ECUADOR EL ORO HUAQUILLAS ECUADOR","1,8,406,1248","593 07 07 01",ECU,"EC EOR HUA ECU"
1249,02,4,"EL PARAÍSO",406,"ECUADOR EL ORO HUAQUILLAS EL PARAÍSO","1,8,406,1249","593 07 07 02",ELP,"EC EOR HUA ELP"
1250,03,4,HUALTACO,406,"ECUADOR EL ORO HUAQUILLAS HUALTACO","1,8,406,1250","593 07 07 03",HUA,"EC EOR HUA HUA"
1251,04,4,"MILTON REYES",406,"ECUADOR EL ORO HUAQUILLAS MILTON REYES","1,8,406,1251","593 07 07 04",MIL,"EC EOR HUA MIL"
1252,05,4,"UNIÓN LOJANA",406,"ECUADOR EL ORO HUAQUILLAS UNIÓN LOJANA","1,8,406,1252","593 07 07 05",UNI,"EC EOR HUA UNI"
1253,50,8,"MARCABELÍ, CABECERA CANTONAL",407,"ECUADOR EL ORO MARCABELÍ MARCABELÍ, CABECERA CANTONAL","1,8,407,1253","593 07 08 50",MAR,"EC EOR MAR MAR"
1254,51,5,"EL INGENIO",407,"ECUADOR EL ORO MARCABELÍ EL INGENIO","1,8,407,1254","593 07 08 51",ELI,"EC EOR MAR ELI"
1255,50,8,"PASAJE, CABECERA CANTONAL",408,"ECUADOR EL ORO PASAJE PASAJE, CABECERA CANTONAL","1,8,408,1255","593 07 09 50",PAS,"EC EOR PAS PAS"
1256,01,4,BOLÍVAR,408,"ECUADOR EL ORO PASAJE BOLÍVAR","1,8,408,1256","593 07 09 01",BOL,"EC EOR PAS BOL"
1257,02,4,"LOMA DE FRANCO",408,"ECUADOR EL ORO PASAJE LOMA DE FRANCO","1,8,408,1257","593 07 09 02",LOM,"EC EOR PAS LOM"
1258,03,4,"OCHOA LEÓN (MATRIZ)",408,"ECUADOR EL ORO PASAJE OCHOA LEÓN (MATRIZ)","1,8,408,1258","593 07 09 03",OCH,"EC EOR PAS OCH"
1259,04,4,"TRES CERRITOS",408,"ECUADOR EL ORO PASAJE TRES CERRITOS","1,8,408,1259","593 07 09 04",TRE,"EC EOR PAS TRE"
1260,51,5,BUENAVISTA,408,"ECUADOR EL ORO PASAJE BUENAVISTA","1,8,408,1260","593 07 09 51",BUE,"EC EOR PAS BUE"
1261,52,5,CASACAY,408,"ECUADOR EL ORO PASAJE CASACAY","1,8,408,1261","593 07 09 52",CAS,"EC EOR PAS CAS"
1262,53,5,"LA PEAÑA",408,"ECUADOR EL ORO PASAJE LA PEAÑA","1,8,408,1262","593 07 09 53",LAP,"EC EOR PAS LAP"
1263,54,5,PROGRESO,408,"ECUADOR EL ORO PASAJE PROGRESO","1,8,408,1263","593 07 09 54",PRO,"EC EOR PAS PRO"
1264,55,5,UZHCURRUMI,408,"ECUADOR EL ORO PASAJE UZHCURRUMI","1,8,408,1264","593 07 09 55",UZH,"EC EOR PAS UZH"
1265,56,5,"CAÑAQUEMADA ",408,"ECUADOR EL ORO PASAJE CAÑAQUEMADA ","1,8,408,1265","593 07 09 56",CAÑ,"EC EOR PAS CAÑ"
1266,50,8,"PIÑAS, CABECERA CANTONAL",409,"ECUADOR EL ORO PIÑAS PIÑAS, CABECERA CANTONAL","1,8,409,1266","593 07 10 50",PIÑ,"EC EOR PIÑ PIÑ"
1267,01,4,"LA MATRIZ",409,"ECUADOR EL ORO PIÑAS LA MATRIZ","1,8,409,1267","593 07 10 01",LAM,"EC EOR PIÑ LAM"
1268,02,4,"LA SUSAYA",409,"ECUADOR EL ORO PIÑAS LA SUSAYA","1,8,409,1268","593 07 10 02",LAS,"EC EOR PIÑ LAS"
1269,03,4,"PIÑAS GRANDE",409,"ECUADOR EL ORO PIÑAS PIÑAS GRANDE","1,8,409,1269","593 07 10 03",PIÑ,"EC EOR PIÑ PIÑ"
1270,51,5,"CAPIRO (CAB. EN LA CAPILLA DE CAPIRO)",409,"ECUADOR EL ORO PIÑAS CAPIRO (CAB. EN LA CAPILLA DE CAPIRO)","1,8,409,1270","593 07 10 51",CAP,"EC EOR PIÑ CAP"
1271,52,5,"LA BOCANA",409,"ECUADOR EL ORO PIÑAS LA BOCANA","1,8,409,1271","593 07 10 52",LAB,"EC EOR PIÑ LAB"
1272,53,5,"MOROMORO (CAB. EN EL VADO)",409,"ECUADOR EL ORO PIÑAS MOROMORO (CAB. EN EL VADO)","1,8,409,1272","593 07 10 53",MOR,"EC EOR PIÑ MOR"
1273,54,5,PIEDRAS,409,"ECUADOR EL ORO PIÑAS PIEDRAS","1,8,409,1273","593 07 10 54",PIE,"EC EOR PIÑ PIE"
1274,55,5,"SAN ROQUE (AMBROSIO MALDONADO)",409,"ECUADOR EL ORO PIÑAS SAN ROQUE (AMBROSIO MALDONADO)","1,8,409,1274","593 07 10 55",SAN,"EC EOR PIÑ SAN"
1275,56,5,SARACAY,409,"ECUADOR EL ORO PIÑAS SARACAY","1,8,409,1275","593 07 10 56",SAR,"EC EOR PIÑ SAR"
1276,50,8,"PORTOVELO, CABECERA CANTONAL",410,"ECUADOR EL ORO PORTOVELO PORTOVELO, CABECERA CANTONAL","1,8,410,1276","593 07 11 50",POR,"EC EOR POR POR"
1277,51,5,CURTINCAPA,410,"ECUADOR EL ORO PORTOVELO CURTINCAPA","1,8,410,1277","593 07 11 51",CUR,"EC EOR POR CUR"
1278,52,5,MORALES,410,"ECUADOR EL ORO PORTOVELO MORALES","1,8,410,1278","593 07 11 52",MOR,"EC EOR POR MOR"
1279,53,5,SALATÍ,410,"ECUADOR EL ORO PORTOVELO SALATÍ","1,8,410,1279","593 07 11 53",SAL,"EC EOR POR SAL"
1280,50,8,"SANTA ROSA, CABECERA CANTONAL",411,"ECUADOR EL ORO SANTA ROSA SANTA ROSA, CABECERA CANTONAL","1,8,411,1280","593 07 12 50",SAN,"EC EOR SRO SAN"
1281,01,4,"SANTA ROSA",411,"ECUADOR EL ORO SANTA ROSA SANTA ROSA","1,8,411,1281","593 07 12 01",SAN,"EC EOR SRO SAN"
1282,02,4,"PUERTO JELÍ",411,"ECUADOR EL ORO SANTA ROSA PUERTO JELÍ","1,8,411,1282","593 07 12 02",PUE,"EC EOR SRO PUE"
1283,03,4,"BALNEARIO JAMBELÍ (SATÉLITE)",411,"ECUADOR EL ORO SANTA ROSA BALNEARIO JAMBELÍ (SATÉLITE)","1,8,411,1283","593 07 12 03",BAL,"EC EOR SRO BAL"
1284,04,4,"JUMÓN (SATÉLITE)",411,"ECUADOR EL ORO SANTA ROSA JUMÓN (SATÉLITE)","1,8,411,1284","593 07 12 04",JUM,"EC EOR SRO JUM"
1285,05,4,"NUEVO SANTA ROSA",411,"ECUADOR EL ORO SANTA ROSA NUEVO SANTA ROSA","1,8,411,1285","593 07 12 05",NUE,"EC EOR SRO NUE"
1286,51,5,BELLAVISTA,411,"ECUADOR EL ORO SANTA ROSA BELLAVISTA","1,8,411,1286","593 07 12 51",BEL,"EC EOR SRO BEL"
1287,52,5,JAMBELÍ,411,"ECUADOR EL ORO SANTA ROSA JAMBELÍ","1,8,411,1287","593 07 12 52",JAM,"EC EOR SRO JAM"
1288,53,5,"LA AVANZADA",411,"ECUADOR EL ORO SANTA ROSA LA AVANZADA","1,8,411,1288","593 07 12 53",LAA,"EC EOR SRO LAA"
1289,54,5,"SAN ANTONIO",411,"ECUADOR EL ORO SANTA ROSA SAN ANTONIO","1,8,411,1289","593 07 12 54",SAN,"EC EOR SRO SAN"
1290,55,5,TORATA,411,"ECUADOR EL ORO SANTA ROSA TORATA","1,8,411,1290","593 07 12 55",TOR,"EC EOR SRO TOR"
1291,56,5,VICTORIA,411,"ECUADOR EL ORO SANTA ROSA VICTORIA","1,8,411,1291","593 07 12 56",VIC,"EC EOR SRO VIC"
1292,57,5,BELLAMARÍA,411,"ECUADOR EL ORO SANTA ROSA BELLAMARÍA","1,8,411,1292","593 07 12 57",BEL,"EC EOR SRO BEL"
1293,50,8,"ZARUMA, CABECERA CANTONAL",412,"ECUADOR EL ORO ZARUMA ZARUMA, CABECERA CANTONAL","1,8,412,1293","593 07 13 50",ZAR,"EC EOR ZAR ZAR"
1294,51,5,ABAÑÍN,412,"ECUADOR EL ORO ZARUMA ABAÑÍN","1,8,412,1294","593 07 13 51",ABA,"EC EOR ZAR ABA"
1295,52,5,ARCAPAMBA,412,"ECUADOR EL ORO ZARUMA ARCAPAMBA","1,8,412,1295","593 07 13 52",ARC,"EC EOR ZAR ARC"
1296,53,5,GUANAZÁN,412,"ECUADOR EL ORO ZARUMA GUANAZÁN","1,8,412,1296","593 07 13 53",GUA,"EC EOR ZAR GUA"
1297,54,5,GUIZHAGUIÑA,412,"ECUADOR EL ORO ZARUMA GUIZHAGUIÑA","1,8,412,1297","593 07 13 54",GUI,"EC EOR ZAR GUI"
1298,55,5,HUERTAS,412,"ECUADOR EL ORO ZARUMA HUERTAS","1,8,412,1298","593 07 13 55",HUE,"EC EOR ZAR HUE"
1299,56,5,MALVAS,412,"ECUADOR EL ORO ZARUMA MALVAS","1,8,412,1299","593 07 13 56",MAL,"EC EOR ZAR MAL"
1300,57,5,"MULUNCAY GRANDE",412,"ECUADOR EL ORO ZARUMA MULUNCAY GRANDE","1,8,412,1300","593 07 13 57",MUL,"EC EOR ZAR MUL"
1301,58,5,SINSAO,412,"ECUADOR EL ORO ZARUMA SINSAO","1,8,412,1301","593 07 13 58",SIN,"EC EOR ZAR SIN"
1302,59,5,SALVIAS,412,"ECUADOR EL ORO ZARUMA SALVIAS","1,8,412,1302","593 07 13 59",SAL,"EC EOR ZAR SAL"
1303,50,8,"LA VICTORIA, CABECERA CANTONAL",413,"ECUADOR EL ORO LAS LAJAS LA VICTORIA, CABECERA CANTONAL","1,8,413,1303","593 07 14 50",LAV,"EC EOR LLA LAV"
1304,01,4,"LA VICTORIA",413,"ECUADOR EL ORO LAS LAJAS LA VICTORIA","1,8,413,1304","593 07 14 01",LAV,"EC EOR LLA LAV"
1305,02,4,PLATANILLOS,413,"ECUADOR EL ORO LAS LAJAS PLATANILLOS","1,8,413,1305","593 07 14 02",PLA,"EC EOR LLA PLA"
1306,03,4,"VALLE HERMOSO",413,"ECUADOR EL ORO LAS LAJAS VALLE HERMOSO","1,8,413,1306","593 07 14 03",VAL,"EC EOR LLA VAL"
1307,51,5,"LA LIBERTAD",413,"ECUADOR EL ORO LAS LAJAS LA LIBERTAD","1,8,413,1307","593 07 14 51",LAL,"EC EOR LLA LAL"
1308,52,5,"EL PARAÍSO ",413,"ECUADOR EL ORO LAS LAJAS EL PARAÍSO ","1,8,413,1308","593 07 14 52",ELP,"EC EOR LLA ELP"
1309,53,5,"SAN ISIDRO",413,"ECUADOR EL ORO LAS LAJAS SAN ISIDRO","1,8,413,1309","593 07 14 53",SAN,"EC EOR LLA SAN"
1310,50,8,"GUAYAQUIL, CABECERA CANTONAL Y CAPITAL PROVINCIAL",55,"ECUADOR GUAYAS GUAYAQUIL GUAYAQUIL, CABECERA CANTONAL Y CAPITAL PROVINCIAL","1,10,55,1310","593 09 01 50",GUA,"EC GUY UYE GUA"
1311,01,4,AYACUCHO,55,"ECUADOR GUAYAS GUAYAQUIL AYACUCHO","1,10,55,1311","593 09 01 01",AYA,"EC GUY UYE AYA"
1312,02,4,"BOLÍVAR  (SAGRARIO) ",55,"ECUADOR GUAYAS GUAYAQUIL BOLÍVAR  (SAGRARIO) ","1,10,55,1312","593 09 01 02",BOL,"EC GUY UYE BOL"
1313,03,4,"CARBO (CONCEPCIÓN) ",55,"ECUADOR GUAYAS GUAYAQUIL CARBO (CONCEPCIÓN) ","1,10,55,1313","593 09 01 03",CAR,"EC GUY UYE CAR"
1314,04,4,"FEBRES CORDERO",55,"ECUADOR GUAYAS GUAYAQUIL FEBRES CORDERO","1,10,55,1314","593 09 01 04",FEB,"EC GUY UYE FEB"
1315,05,4,"GARCÍA MORENO",55,"ECUADOR GUAYAS GUAYAQUIL GARCÍA MORENO","1,10,55,1315","593 09 01 05",GAR,"EC GUY UYE GAR"
1316,06,4,LETAMENDI,55,"ECUADOR GUAYAS GUAYAQUIL LETAMENDI","1,10,55,1316","593 09 01 06",LET,"EC GUY UYE LET"
1317,07,4,"NUEVE DE OCTUBRE",55,"ECUADOR GUAYAS GUAYAQUIL NUEVE DE OCTUBRE","1,10,55,1317","593 09 01 07",NUE,"EC GUY UYE NUE"
1318,08,4,"OLMEDO  (SAN ALEJO) ",55,"ECUADOR GUAYAS GUAYAQUIL OLMEDO  (SAN ALEJO) ","1,10,55,1318","593 09 01 08",OLM,"EC GUY UYE OLM"
1319,09,4,ROCA,55,"ECUADOR GUAYAS GUAYAQUIL ROCA","1,10,55,1319","593 09 01 09",ROC,"EC GUY UYE ROC"
1320,10,4,ROCAFUERTE,55,"ECUADOR GUAYAS GUAYAQUIL ROCAFUERTE","1,10,55,1320","593 09 01 10",ROC,"EC GUY UYE ROC"
1321,11,4,SUCRE,55,"ECUADOR GUAYAS GUAYAQUIL SUCRE","1,10,55,1321","593 09 01 11",SUC,"EC GUY UYE SUC"
1322,12,4,TARQUI,55,"ECUADOR GUAYAS GUAYAQUIL TARQUI","1,10,55,1322","593 09 01 12",TAR,"EC GUY UYE TAR"
1323,13,4,URDANETA,55,"ECUADOR GUAYAS GUAYAQUIL URDANETA","1,10,55,1323","593 09 01 13",URD,"EC GUY UYE URD"
1324,14,4,XIMENA,55,"ECUADOR GUAYAS GUAYAQUIL XIMENA","1,10,55,1324","593 09 01 14",XIM,"EC GUY UYE XIM"
1325,15,4,PASCUALES,55,"ECUADOR GUAYAS GUAYAQUIL PASCUALES","1,10,55,1325","593 09 01 15",PAS,"EC GUY UYE PAS"
1326,52,5,"JUAN GÓMEZ RENDÓN (PROGRESO) ",55,"ECUADOR GUAYAS GUAYAQUIL JUAN GÓMEZ RENDÓN (PROGRESO) ","1,10,55,1326","593 09 01 52",JUA,"EC GUY UYE JUA"
1327,53,5,MORRO,55,"ECUADOR GUAYAS GUAYAQUIL MORRO","1,10,55,1327","593 09 01 53",MOR,"EC GUY UYE MOR"
1328,56,5,POSORJA,55,"ECUADOR GUAYAS GUAYAQUIL POSORJA","1,10,55,1328","593 09 01 56",POS,"EC GUY UYE POS"
1329,57,5,PUNÁ,55,"ECUADOR GUAYAS GUAYAQUIL PUNÁ","1,10,55,1329","593 09 01 57",PUN,"EC GUY UYE PUN"
1330,58,5,TENGUEL,55,"ECUADOR GUAYAS GUAYAQUIL TENGUEL","1,10,55,1330","593 09 01 58",TEN,"EC GUY UYE TEN"
1331,50,8,"ALFREDO BAQUERIZO MORENO (JUJÁN), CABECERA CANTONAL",451,"ECUADOR GUAYAS ALFREDO BAQUERIZO MORENO (JUJÁN) ALFREDO BAQUERIZO MORENO (JUJÁN), CABECERA CANTONAL","1,10,451,1331","593 09 02 50",ALF,"EC GUA ABM ALF"
1332,50,8,"BALAO, CABECERA CANTONAL",452,"ECUADOR GUAYAS BALAO BALAO, CABECERA CANTONAL","1,10,452,1332","593 09 03 50",BAL,"EC GUA BAO BAL"
1333,50,8,"BALZAR, CABECERA CANTONAL",453,"ECUADOR GUAYAS BALZAR BALZAR, CABECERA CANTONAL","1,10,453,1333","593 09 04 50",BAL,"EC GUA BAZ BAL"
1334,50,8,"COLIMES, CABECERA CANTONAL",454,"ECUADOR GUAYAS COLIMES COLIMES, CABECERA CANTONAL","1,10,454,1334","593 09 05 50",COL,"EC GUA COL COL"
1335,51,5,"SAN JACINTO",454,"ECUADOR GUAYAS COLIMES SAN JACINTO","1,10,454,1335","593 09 05 51",SAN,"EC GUA COL SAN"
1336,50,8,"DAULE, CABECERA CANTONAL",455,"ECUADOR GUAYAS DAULE DAULE, CABECERA CANTONAL","1,10,455,1336","593 09 06 50",DAU,"EC GUA DAU DAU"
1337,01,4,DAULE,455,"ECUADOR GUAYAS DAULE DAULE","1,10,455,1337","593 09 06 01",DAU,"EC GUA DAU DAU"
1338,02,4,"LA AURORA (SATÉLITE)",455,"ECUADOR GUAYAS DAULE LA AURORA (SATÉLITE)","1,10,455,1338","593 09 06 02",LAA,"EC GUA DAU LAA"
1339,03,4,BANIFE,455,"ECUADOR GUAYAS DAULE BANIFE","1,10,455,1339","593 09 06 03",BAN,"EC GUA DAU BAN"
1340,04,4,"EMILIANO CAICEDO MARCOS",455,"ECUADOR GUAYAS DAULE EMILIANO CAICEDO MARCOS","1,10,455,1340","593 09 06 04",EMI,"EC GUA DAU EMI"
1341,05,4,MAGRO,455,"ECUADOR GUAYAS DAULE MAGRO","1,10,455,1341","593 09 06 05",MAG,"EC GUA DAU MAG"
1342,06,4,"PADRE JUAN BAUTISTA AGUIRRE",455,"ECUADOR GUAYAS DAULE PADRE JUAN BAUTISTA AGUIRRE","1,10,455,1342","593 09 06 06",PAD,"EC GUA DAU PAD"
1343,07,4,"SANTA CLARA",455,"ECUADOR GUAYAS DAULE SANTA CLARA","1,10,455,1343","593 09 06 07",SAN,"EC GUA DAU SAN"
1344,08,4,"VICENTE PIEDRAHITA",455,"ECUADOR GUAYAS DAULE VICENTE PIEDRAHITA","1,10,455,1344","593 09 06 08",VIC,"EC GUA DAU VIC"
1345,52,5,"JUAN BAUTISTA AGUIRRE (LOS TINTOS) ",455,"ECUADOR GUAYAS DAULE JUAN BAUTISTA AGUIRRE (LOS TINTOS) ","1,10,455,1345","593 09 06 52",JUA,"EC GUA DAU JUA"
1346,53,5,LAUREL,455,"ECUADOR GUAYAS DAULE LAUREL","1,10,455,1346","593 09 06 53",LAU,"EC GUA DAU LAU"
1347,54,5,LIMONAL,455,"ECUADOR GUAYAS DAULE LIMONAL","1,10,455,1347","593 09 06 54",LIM,"EC GUA DAU LIM"
1348,56,5,"LOS LOJAS (ENRIQUE BAQUERIZO MORENO)",455,"ECUADOR GUAYAS DAULE LOS LOJAS (ENRIQUE BAQUERIZO MORENO)","1,10,455,1348","593 09 06 56",LOS,"EC GUA DAU LOS"
1349,50,8,"ELOY ALFARO (DURÁN), CABECERA CANTONAL",456,"ECUADOR GUAYAS DURÁN ELOY ALFARO (DURÁN), CABECERA CANTONAL","1,10,456,1349","593 09 07 50",ELO,"EC GUA DUR ELO"
1350,01,4,"ELOY ALFARO (DURÁN)",456,"ECUADOR GUAYAS DURÁN ELOY ALFARO (DURÁN)","1,10,456,1350","593 09 07 01",ELO,"EC GUA DUR ELO"
1351,02,4,"EL RECREO",456,"ECUADOR GUAYAS DURÁN EL RECREO","1,10,456,1351","593 09 07 02",ELR,"EC GUA DUR ELR"
1352,50,8,"VELASCO IBARRA (EL EMPALME), CABECERA CANTONAL",457,"ECUADOR GUAYAS EL EMPALME VELASCO IBARRA (EL EMPALME), CABECERA CANTONAL","1,10,457,1352","593 09 08 50",VEL,"EC GUA EEM VEL"
1353,51,5,"GUAYAS (PUEBLO NUEVO) ",457,"ECUADOR GUAYAS EL EMPALME GUAYAS (PUEBLO NUEVO) ","1,10,457,1353","593 09 08 51",GUA,"EC GUA EEM GUA"
1354,52,5,"EL ROSARIO",457,"ECUADOR GUAYAS EL EMPALME EL ROSARIO","1,10,457,1354","593 09 08 52",ELR,"EC GUA EEM ELR"
1355,50,8,"EL TRIUNFO, CABECERA CANTONAL",458,"ECUADOR GUAYAS EL TRIUNFO EL TRIUNFO, CABECERA CANTONAL","1,10,458,1355","593 09 09 50",ELT,"EC GUA ETR ELT"
1356,50,8,"MILAGRO, CABECERA CANTONAL",459,"ECUADOR GUAYAS MILAGRO MILAGRO, CABECERA CANTONAL","1,10,459,1356","593 09 10 50",MIL,"EC GUA MIL MIL"
1357,51,5,CHOBO,459,"ECUADOR GUAYAS MILAGRO CHOBO","1,10,459,1357","593 09 10 51",CHO,"EC GUA MIL CHO"
1358,53,5,"MARISCAL SUCRE (HUAQUES)",459,"ECUADOR GUAYAS MILAGRO MARISCAL SUCRE (HUAQUES)","1,10,459,1358","593 09 10 53",MAR,"EC GUA MIL MAR"
1359,54,5,"ROBERTO ASTUDILLO (CAB. EN CRUCE DE VENECIA) ",459,"ECUADOR GUAYAS MILAGRO ROBERTO ASTUDILLO (CAB. EN CRUCE DE VENECIA) ","1,10,459,1359","593 09 10 54",ROB,"EC GUA MIL ROB"
1360,50,8,"NARANJAL, CABECERA CANTONAL",460,"ECUADOR GUAYAS NARANJAL NARANJAL, CABECERA CANTONAL","1,10,460,1360","593 09 11 50",NAR,"EC GUA NAL NAR"
1361,51,5,"JESÚS MARÍA",460,"ECUADOR GUAYAS NARANJAL JESÚS MARÍA","1,10,460,1361","593 09 11 51",JES,"EC GUA NAL JES"
1362,52,5,"SAN CARLOS",460,"ECUADOR GUAYAS NARANJAL SAN CARLOS","1,10,460,1362","593 09 11 52",SAN,"EC GUA NAL SAN"
1363,53,5,"SANTA ROSA DE FLANDES",460,"ECUADOR GUAYAS NARANJAL SANTA ROSA DE FLANDES","1,10,460,1363","593 09 11 53",SAN,"EC GUA NAL SAN"
1364,54,5,TAURA,460,"ECUADOR GUAYAS NARANJAL TAURA","1,10,460,1364","593 09 11 54",TAU,"EC GUA NAL TAU"
1365,50,8,"NARANJITO, CABECERA CANTONAL",461,"ECUADOR GUAYAS NARANJITO NARANJITO, CABECERA CANTONAL","1,10,461,1365","593 09 12 50",NAR,"EC GUA NAO NAR"
1366,50,8,"PALESTINA,CABECERA CANTONAL",462,"ECUADOR GUAYAS PALESTINA PALESTINA,CABECERA CANTONAL","1,10,462,1366","593 09 13 50",PAL,"EC GUA PAL PAL"
1367,50,8,"PEDRO CARBO, CABECERA CANTONAL",463,"ECUADOR GUAYAS PEDRO CARBO PEDRO CARBO, CABECERA CANTONAL","1,10,463,1367","593 09 14 50",PED,"EC GUA PCA PED"
1368,51,5,"VALLE DE LA VIRGEN ",463,"ECUADOR GUAYAS PEDRO CARBO VALLE DE LA VIRGEN ","1,10,463,1368","593 09 14 51",VAL,"EC GUA PCA VAL"
1369,52,5,SABANILLA,463,"ECUADOR GUAYAS PEDRO CARBO SABANILLA","1,10,463,1369","593 09 14 52",SAB,"EC GUA PCA SAB"
1370,50,8,"SAMBORONDÓN, CABECERA CANTONAL",465,"ECUADOR GUAYAS SAMBORONDÓN SAMBORONDÓN, CABECERA CANTONAL","1,10,465,1370","593 09 16 50",SAM,"EC GUA SAM SAM"
1371,01,4,SAMBORONDÓN,465,"ECUADOR GUAYAS SAMBORONDÓN SAMBORONDÓN","1,10,465,1371","593 09 16 01",SAM,"EC GUA SAM SAM"
1372,02,4,"LA PUNTILLA (SATÉLITE)",465,"ECUADOR GUAYAS SAMBORONDÓN LA PUNTILLA (SATÉLITE)","1,10,465,1372","593 09 16 02",LAP,"EC GUA SAM LAP"
1373,51,5,TARIFA,465,"ECUADOR GUAYAS SAMBORONDÓN TARIFA","1,10,465,1373","593 09 16 51",TAR,"EC GUA SAM TAR"
1374,50,8,"SANTA LUCÍA, CABECERA CANTONAL",467,"ECUADOR GUAYAS SANTA LUCÍA SANTA LUCÍA, CABECERA CANTONAL","1,10,467,1374","593 09 18 50",SAN,"EC GUA SLU SAN"
1375,50,8,"EL SALITRE (LAS RAMAS),  CABECERA CANTONAL",468,"ECUADOR GUAYAS SALITRE (URBINA JADO) EL SALITRE (LAS RAMAS),  CABECERA CANTONAL","1,10,468,1375","593 09 19 50",ELS,"EC GUA SAL ELS"
1376,01,4,BOCANA,468,"ECUADOR GUAYAS SALITRE (URBINA JADO) BOCANA","1,10,468,1376","593 09 19 01",BOC,"EC GUA SAL BOC"
1377,02,4,CANDILEJOS,468,"ECUADOR GUAYAS SALITRE (URBINA JADO) CANDILEJOS","1,10,468,1377","593 09 19 02",CAN,"EC GUA SAL CAN"
1378,03,4,CENTRAL,468,"ECUADOR GUAYAS SALITRE (URBINA JADO) CENTRAL","1,10,468,1378","593 09 19 03",CEN,"EC GUA SAL CEN"
1379,04,4,PARAÍSO,468,"ECUADOR GUAYAS SALITRE (URBINA JADO) PARAÍSO","1,10,468,1379","593 09 19 04",PAR,"EC GUA SAL PAR"
1380,05,4,"SAN MATEO",468,"ECUADOR GUAYAS SALITRE (URBINA JADO) SAN MATEO","1,10,468,1380","593 09 19 05",SAN,"EC GUA SAL SAN"
1381,51,5,"GRAL. VERNAZA (DOS ESTEROS) ",468,"ECUADOR GUAYAS SALITRE (URBINA JADO) GRAL. VERNAZA (DOS ESTEROS) ","1,10,468,1381","593 09 19 51",GRA,"EC GUA SAL GRA"
1382,52,5,"LA VICTORIA (ÑAUZA)",468,"ECUADOR GUAYAS SALITRE (URBINA JADO) LA VICTORIA (ÑAUZA)","1,10,468,1382","593 09 19 52",LAV,"EC GUA SAL LAV"
1383,53,5,JUNQUILLAL,468,"ECUADOR GUAYAS SALITRE (URBINA JADO) JUNQUILLAL","1,10,468,1383","593 09 19 53",JUN,"EC GUA SAL JUN"
1384,50,8,"SAN JACINTO DE YAGUACHI,CABECERA CANTONAL",469,"ECUADOR GUAYAS SAN JACINTO DE YAGUACHI SAN JACINTO DE YAGUACHI,CABECERA CANTONAL","1,10,469,1384","593 09 20 50",SAN,"EC GUA SJA SAN"
1385,53,5,"GRAL. PEDRO J. MONTERO (BOLICHE) ",469,"ECUADOR GUAYAS SAN JACINTO DE YAGUACHI GRAL. PEDRO J. MONTERO (BOLICHE) ","1,10,469,1385","593 09 20 53",GRA,"EC GUA SJA GRA"
1386,55,5,"YAGUACHI VIEJO (CONE)",469,"ECUADOR GUAYAS SAN JACINTO DE YAGUACHI YAGUACHI VIEJO (CONE)","1,10,469,1386","593 09 20 55",YAG,"EC GUA SJA YAG"
1387,56,5,"VIRGEN DE FÁTIMA",469,"ECUADOR GUAYAS SAN JACINTO DE YAGUACHI VIRGEN DE FÁTIMA","1,10,469,1387","593 09 20 56",VIR,"EC GUA SJA VIR"
1388,50,8,"GENERAL VILLAMIL (PLAYAS), CABECERA CANTONAL",470,"ECUADOR GUAYAS PLAYAS GENERAL VILLAMIL (PLAYAS), CABECERA CANTONAL","1,10,470,1388","593 09 21 50",GEN,"EC GUA PLA GEN"
1389,50,8,"SIMÓN BOLÍVAR, CABECERA CANTONAL",471,"ECUADOR GUAYAS SIMÓN BOLÍVAR SIMÓN BOLÍVAR, CABECERA CANTONAL","1,10,471,1389","593 09 22 50",SIM,"EC GUA SBO SIM"
1390,51,5,"CRNEL.LORENZO DE GARAICOA (PEDREGAL)",471,"ECUADOR GUAYAS SIMÓN BOLÍVAR CRNEL.LORENZO DE GARAICOA (PEDREGAL)","1,10,471,1390","593 09 22 51",CRN,"EC GUA SBO CRN"
1391,50,8,"CORONEL MARCELINO MARIDUEÑA (SAN CARLOS), CABECERA CANTONAL",472,"ECUADOR GUAYAS CORONEL MARCELINO MARIDUEÑA CORONEL MARCELINO MARIDUEÑA (SAN CARLOS), CABECERA CANTONAL","1,10,472,1391","593 09 23 50",COR,"EC GUA CMM COR"
1392,50,8,"LOMAS DE SARGENTILLO, CABECERA CANTONAL",473,"ECUADOR GUAYAS LOMAS DE SARGENTILLO LOMAS DE SARGENTILLO, CABECERA CANTONAL","1,10,473,1392","593 09 24 50",LOM,"EC GUA LSA LOM"
1393,50,8,"NARCISA DE JESÚS, CABECERA CANTONAL",474,"ECUADOR GUAYAS NOBOL NARCISA DE JESÚS, CABECERA CANTONAL","1,10,474,1393","593 09 25 50",NAR,"EC GUA NOB NAR"
1394,50,8,"GENERAL ANTONIO ELIZALDE (BUCAY), CABECERA CANTONAL",476,"ECUADOR GUAYAS GENERAL ANTONIO ELIZALDE (BUCAY) GENERAL ANTONIO ELIZALDE (BUCAY), CABECERA CANTONAL","1,10,476,1394","593 09 27 50",GEN,"EC GUA GAE GEN"
1395,50,8,"ISIDRO AYORA, CABECERA CANTONAL",477,"ECUADOR GUAYAS ISIDRO AYORA ISIDRO AYORA, CABECERA CANTONAL","1,10,477,1395","593 09 28 50",ISI,"EC GUA IAY ISI"
1396,50,8,"BABAHOYO, CABECERA CANTONAL Y CAPITAL PROVINCIAL",500,"ECUADOR LOS RIOS BABAHOYO BABAHOYO, CABECERA CANTONAL Y CAPITAL PROVINCIAL","1,13,500,1396","593 12 01 50",BAB,"EC LRI BAH BAB"
1397,01,4,"CLEMENTE BAQUERIZO",500,"ECUADOR LOS RIOS BABAHOYO CLEMENTE BAQUERIZO","1,13,500,1397","593 12 01 01",CLE,"EC LRI BAH CLE"
1398,02,4,"DOCTOR CAMILO PONCE ",500,"ECUADOR LOS RIOS BABAHOYO DOCTOR CAMILO PONCE ","1,13,500,1398","593 12 01 02",DR.,"EC LRI BAH DR."
1399,03,4,BARREIRO,500,"ECUADOR LOS RIOS BABAHOYO BARREIRO(ANTERIOR)","1,13,500,1399","593 12 01 03",BAR,"EC LRI BAH BAR"
1400,04,4,"EL SALTO",500,"ECUADOR LOS RIOS BABAHOYO EL SALTO","1,13,500,1400","593 12 01 04",ELS,"EC LRI BAH ELS"
1401,52,5,CARACOL,500,"ECUADOR LOS RIOS BABAHOYO CARACOL","1,13,500,1401","593 12 01 52",CAR,"EC LRI BAH CAR"
1402,53,5,"FEBRES CORDERO (LAS JUNTAS)",500,"ECUADOR LOS RIOS BABAHOYO FEBRES CORDERO (LAS JUNTAS)","1,13,500,1402","593 12 01 53",FEB,"EC LRI BAH FEB"
1403,54,5,PIMOCHA,500,"ECUADOR LOS RIOS BABAHOYO PIMOCHA","1,13,500,1403","593 12 01 54",PIM,"EC LRI BAH PIM"
1404,55,5,"LA UNIÓN",500,"ECUADOR LOS RIOS BABAHOYO LA UNIÓN","1,13,500,1404","593 12 01 55",LAU,"EC LRI BAH LAU"
1405,50,8,"BABA, CABECERA CANTONAL",501,"ECUADOR LOS RIOS BABA BABA, CABECERA CANTONAL","1,13,501,1405","593 12 02 50",BAB,"EC LRI BAB BAB"
1406,51,5,GUARE,501,"ECUADOR LOS RIOS BABA GUARE","1,13,501,1406","593 12 02 51",GUA,"EC LRI BAB GUA"
1407,52,5,"ISLA DE BEJUCAL",501,"ECUADOR LOS RIOS BABA ISLA DE BEJUCAL","1,13,501,1407","593 12 02 52",ISL,"EC LRI BAB ISL"
1408,50,8,"MONTALVO, CABECERA CANTONAL",502,"ECUADOR LOS RIOS MONTALVO MONTALVO, CABECERA CANTONAL","1,13,502,1408","593 12 03 50",MON,"EC LRI MON MON"
1409,50,8,"PUEBLOVIEJO, CABECERA CANTONAL",503,"ECUADOR LOS RIOS PUEBLOVIEJO PUEBLOVIEJO, CABECERA CANTONAL","1,13,503,1409","593 12 04 50",PUE,"EC LRI PUE PUE"
1410,51,5,"PUERTO PECHICHE",503,"ECUADOR LOS RIOS PUEBLOVIEJO PUERTO PECHICHE","1,13,503,1410","593 12 04 51",PUE,"EC LRI PUE PUE"
1411,52,5,"SAN JUAN",503,"ECUADOR LOS RIOS PUEBLOVIEJO SAN JUAN","1,13,503,1411","593 12 04 52",SAN,"EC LRI PUE SAN"
