ID_TERRITORIO,CODIGO,ID_NIVEL_TERRITORIAL,DESCRIPCION,ID_TERRITORIO_PADRE,PATH_DESCRIPCION,PATH_ID,PATH_CODIGO,NOMECLATURA,PATH_NOMECLATURA
3174,52,5,"LA MERCED DE BUENOS AIRES",3125,"ECUADOR IMBABURA SAN MIGUEL DE URCUQUÍ LA MERCED DE BUENOS AIRES","1,11,3125 3174","593 10 06 52",NULL,NULL
3175,55,5,TUMBABIRO,3125,"ECUADOR IMBABURA SAN MIGUEL DE URCUQUÍ TUMBABIRO","1,11,3125 3175","593 10 06 55",NULL,NULL
3176,54,5,"SAN BLAS",3125,"ECUADOR IMBABURA SAN MIGUEL DE URCUQUÍ SAN BLAS","1,11,3125 3176","593 10 06 54",NULL,NULL
3177,51,5,CAHUASQUÍ,3125,"ECUADOR IMBABURA SAN MIGUEL DE URCUQUÍ CAHUASQUÍ","1,11,3125 3177","593 10 06 51",NULL,NULL
3178,01,3,LOJA,12,"ECUADOR LOJA LOJA ","1,12,3178","593 11 01",NULL,NULL
3179,02,3,"CALVAS ",12,"ECUADOR LOJA CALVAS ","1,12,3179","593 11 02",NULL,NULL
3180,03,3,"CATAMAYO ",12,"ECUADOR LOJA CATAMAYO ","1,12,3180","593 11 03",NULL,NULL
3181,04,3,"CELICA ",12,"ECUADOR LOJA CELICA ","1,12,3181","593 11 04",NULL,NULL
3182,05,3,"CHAGUARPAMBA ",12,"ECUADOR LOJA CHAGUARPAMBA ","1,12,3182","593 11 05",NULL,NULL
3183,06,3,"ESPÍNDOLA ",12,"ECUADOR LOJA ESPÍNDOLA ","1,12,3183","593 11 06",NULL,NULL
3184,07,3,"GONZANAMÁ ",12,"ECUADOR LOJA GONZANAMÁ ","1,12,3184","593 11 07",NULL,NULL
3185,08,3,"MACARÁ ",12,"ECUADOR LOJA MACARÁ ","1,12,3185","593 11 08",NULL,NULL
3186,09,3,PALTAS,12,"ECUADOR LOJA PALTAS","1,12,3186","593 11 09",NULL,NULL
3187,10,3,PUYANGO,12,"ECUADOR LOJA PUYANGO","1,12,3187","593 11 10",NULL,NULL
3188,11,3,SARAGURO,12,"ECUADOR LOJA SARAGURO","1,12,3188","593 11 11",NULL,NULL
3189,12,3,SOZORANGA,12,"ECUADOR LOJA SOZORANGA","1,12,3189","593 11 12",NULL,NULL
3190,13,3,ZAPOTILLO,12,"ECUADOR LOJA ZAPOTILLO","1,12,3190","593 11 13",NULL,NULL
3191,14,3,PINDAL,12,"ECUADOR LOJA PINDAL","1,12,3191","593 11 14",NULL,NULL
3192,15,3,QUILANGA,12,"ECUADOR LOJA QUILANGA","1,12,3192","593 11 15",NULL,NULL
3193,16,3,OLMEDO,12,"ECUADOR LOJA OLMEDO","1,12,3193","593 11 16",NULL,NULL
3194,50,8,"LOJA, CABECERA CANTONAL Y CAPITAL PROVINCIAL",3178,"ECUADOR LOJA LOJA LOJA, CABECERA CANTONAL Y CAPITAL PROVINCIAL","1,12,3178 3194","593 11 01 50",NULL,NULL
3195,01,4,"EL SAGRARIO",3178,"ECUADOR LOJA LOJA EL SAGRARIO","1,12,3178 3195","593 11 01 01",NULL,NULL
3196,02,4,"SAN SEBASTIÁN",3178,"ECUADOR LOJA LOJA SAN SEBASTIÁN","1,12,3178 3196","593 11 01 02",NULL,NULL
3197,04,4,VALLE,3178,"ECUADOR LOJA LOJA VALLE","1,12,3178 3197","593 11 01 04",NULL,NULL
3198,03,4,SUCRE,3178,"ECUADOR LOJA LOJA SUCRE","1,12,3178 3198","593 11 01 03",NULL,NULL
3199,55,5,JIMBILLA,3178,"ECUADOR LOJA LOJA JIMBILLA","1,12,3178 3199","593 11 01 55",NULL,NULL
3200,53,5,"EL CISNE",3178,"ECUADOR LOJA LOJA EL CISNE","1,12,3178 3200","593 11 01 53",NULL,NULL
3201,51,5,CHANTACO,3178,"ECUADOR LOJA LOJA CHANTACO","1,12,3178 3201","593 11 01 51",NULL,NULL
3202,54,5,GUALEL,3178,"ECUADOR LOJA LOJA GUALEL","1,12,3178 3202","593 11 01 54",NULL,NULL
3203,52,5,CHUQUIRIBAMBA,3178,"ECUADOR LOJA LOJA CHUQUIRIBAMBA","1,12,3178 3203","593 11 01 52",NULL,NULL
3204,57,5,"SAN LUCAS",3178,"ECUADOR LOJA LOJA SAN LUCAS","1,12,3178 3204","593 11 01 57",NULL,NULL
3205,56,5,"MALACATOS (VALLADOLID) ",3178,"ECUADOR LOJA LOJA MALACATOS (VALLADOLID) ","1,12,3178 3205","593 11 01 56",NULL,NULL
3206,58,5,"SAN PEDRO DE VILCABAMBA",3178,"ECUADOR LOJA LOJA SAN PEDRO DE VILCABAMBA","1,12,3178 3206","593 11 01 58",NULL,NULL
3207,60,5,"TAQUIL (MIGUEL RIOFRÍO)",3178,"ECUADOR LOJA LOJA TAQUIL (MIGUEL RIOFRÍO)","1,12,3178 3207","593 11 01 60",NULL,NULL
3208,59,5,SANTIAGO,3178,"ECUADOR LOJA LOJA SANTIAGO","1,12,3178 3208","593 11 01 59",NULL,NULL
3209,62,5,"YANGANA (ARSENIO CASTILLO)",3178,"ECUADOR LOJA LOJA YANGANA (ARSENIO CASTILLO)","1,12,3178 3209","593 11 01 62",NULL,NULL
3210,63,5,QUINARA,3178,"ECUADOR LOJA LOJA QUINARA","1,12,3178 3210","593 11 01 63",NULL,NULL
3211,61,5,"VILCABAMBA  (VICTORIA)",3178,"ECUADOR LOJA LOJA VILCABAMBA  (VICTORIA)","1,12,3178 3211","593 11 01 61",NULL,NULL
3212,50,8,"CARIAMANGA, CABECERA CANTONAL",3179,"ECUADOR LOJA CALVAS CARIAMANGA, CABECERA CANTONAL","1,12,3179 3212","593 11 02 50",NULL,NULL
3213,02,4,CHILE,3179,"ECUADOR LOJA CALVAS CHILE","1,12,3179 3213","593 11 02 02",NULL,NULL
3214,51,5,COLAISACA,3179,"ECUADOR LOJA CALVAS COLAISACA","1,12,3179 3214","593 11 02 51",NULL,NULL
3215,03,4,"SAN VICENTE",3179,"ECUADOR LOJA CALVAS SAN VICENTE","1,12,3179 3215","593 11 02 03",NULL,NULL
3216,52,5,"EL LUCERO",3179,"ECUADOR LOJA CALVAS EL LUCERO","1,12,3179 3216","593 11 02 52",NULL,NULL
3217,53,5,UTUANA,3179,"ECUADOR LOJA CALVAS UTUANA","1,12,3179 3217","593 11 02 53",NULL,NULL
3218,54,5,SANGUILLÍN,3179,"ECUADOR LOJA CALVAS SANGUILLÍN","1,12,3179 3218","593 11 02 54",NULL,NULL
3219,01,4,CARIAMANGA,3179,"ECUADOR LOJA CALVAS CARIAMANGA","1,12,3179 3219","593 11 02 01",NULL,NULL
3220,50,8,"CATAMAYO (LA TOMA), CABECERA CANTONAL",3180,"ECUADOR LOJA CATAMAYO CATAMAYO (LA TOMA), CABECERA CANTONAL","1,12,3180 3220","593 11 03 50",NULL,NULL
3221,01,4,CATAMAYO,3180,"ECUADOR LOJA CATAMAYO CATAMAYO","1,12,3180 3221","593 11 03 01",NULL,NULL
3222,53,5,"SAN PEDRO DE LA BENDITA",3180,"ECUADOR LOJA CATAMAYO SAN PEDRO DE LA BENDITA","1,12,3180 3222","593 11 03 53",NULL,NULL
3223,02,4,"SAN JOSÉ",3180,"ECUADOR LOJA CATAMAYO SAN JOSÉ","1,12,3180 3223","593 11 03 02",NULL,NULL
3224,51,5,"EL TAMBO",3180,"ECUADOR LOJA CATAMAYO EL TAMBO","1,12,3180 3224","593 11 03 51",NULL,NULL
3225,54,5,ZAMBI,3180,"ECUADOR LOJA CATAMAYO ZAMBI","1,12,3180 3225","593 11 03 54",NULL,NULL
3226,52,5,GUAYQUICHUMA,3180,"ECUADOR LOJA CATAMAYO GUAYQUICHUMA","1,12,3180 3226","593 11 03 52",NULL,NULL
3227,50,8,"CELICA, CABECERA CANTONAL",3181,"ECUADOR LOJA CELICA CELICA, CABECERA CANTONAL","1,12,3181 3227","593 11 04 50",NULL,NULL
3228,57,5,"TNTE. MAXIMILIANO RODRÍGUEZ LOAIZA ",3181,"ECUADOR LOJA CELICA TNTE. MAXIMILIANO RODRÍGUEZ LOAIZA ","1,12,3181 3228","593 11 04 57",NULL,NULL
3229,55,5,"POZUL (SAN JUAN DE POZUL)",3181,"ECUADOR LOJA CELICA POZUL (SAN JUAN DE POZUL)","1,12,3181 3229","593 11 04 55",NULL,NULL
3230,51,5,"CRUZPAMBA (CAB. EN CARLOS BUSTAMANTE)",3181,"ECUADOR LOJA CELICA CRUZPAMBA (CAB. EN CARLOS BUSTAMANTE)","1,12,3181 3230","593 11 04 51",NULL,NULL
3231,56,5,SABANILLA,3181,"ECUADOR LOJA CELICA SABANILLA","1,12,3181 3231","593 11 04 56",NULL,NULL
3232,50,8,"CHAGUARPAMBA, CABECERA CANTONAL",3182,"ECUADOR LOJA CHAGUARPAMBA CHAGUARPAMBA, CABECERA CANTONAL","1,12,3182 3232","593 11 05 50",NULL,NULL
3233,52,5,"EL ROSARIO",3182,"ECUADOR LOJA CHAGUARPAMBA EL ROSARIO","1,12,3182 3233","593 11 05 52",NULL,NULL
3234,51,5,BUENAVISTA,3182,"ECUADOR LOJA CHAGUARPAMBA BUENAVISTA","1,12,3182 3234","593 11 05 51",NULL,NULL
3235,53,5,"SANTA RUFINA",3182,"ECUADOR LOJA CHAGUARPAMBA SANTA RUFINA","1,12,3182 3235","593 11 05 53",NULL,NULL
3236,54,5,AMARILLOS,3182,"ECUADOR LOJA CHAGUARPAMBA AMARILLOS","1,12,3182 3236","593 11 05 54",NULL,NULL
3237,50,8,"AMALUZA, CABECERA CANTONAL",3183,"ECUADOR LOJA ESPÍNDOLA AMALUZA, CABECERA CANTONAL","1,12,3183 3237","593 11 06 50",NULL,NULL
3238,51,5,BELLAVISTA,3183,"ECUADOR LOJA ESPÍNDOLA BELLAVISTA","1,12,3183 3238","593 11 06 51",NULL,NULL
3239,52,5,JIMBURA,3183,"ECUADOR LOJA ESPÍNDOLA JIMBURA","1,12,3183 3239","593 11 06 52",NULL,NULL
3240,54,5,"27 DE ABRIL (CAB. EN LA NARANJA) ",3183,"ECUADOR LOJA ESPÍNDOLA 27 DE ABRIL (CAB. EN LA NARANJA) ","1,12,3183 3240","593 11 06 54",NULL,NULL
3241,56,5,"EL AIRO",3183,"ECUADOR LOJA ESPÍNDOLA EL AIRO","1,12,3183 3241","593 11 06 56",NULL,NULL
3242,55,5,"EL INGENIO",3183,"ECUADOR LOJA ESPÍNDOLA EL INGENIO","1,12,3183 3242","593 11 06 55",NULL,NULL
3243,53,5,"SANTA TERESITA",3183,"ECUADOR LOJA ESPÍNDOLA SANTA TERESITA","1,12,3183 3243","593 11 06 53",NULL,NULL
3244,50,8,"GONZANAMÁ, CABECERA CANTONAL",3184,"ECUADOR LOJA GONZANAMÁ GONZANAMÁ, CABECERA CANTONAL","1,12,3184 3244","593 11 07 50",NULL,NULL
3245,57,5,SACAPALCA,3184,"ECUADOR LOJA GONZANAMÁ SACAPALCA","1,12,3184 3245","593 11 07 57",NULL,NULL
3246,54,5,"PURUNUMA (EGUIGUREN) ",3184,"ECUADOR LOJA GONZANAMÁ PURUNUMA (EGUIGUREN) ","1,12,3184 3246","593 11 07 54",NULL,NULL
3247,53,5,NAMBACOLA,3184,"ECUADOR LOJA GONZANAMÁ NAMBACOLA","1,12,3184 3247","593 11 07 53",NULL,NULL
3248,51,5,"CHANGAIMINA (LA LIBERTAD) ",3184,"ECUADOR LOJA GONZANAMÁ CHANGAIMINA (LA LIBERTAD) ","1,12,3184 3248","593 11 07 51",NULL,NULL
3249,53,5,"SABIANGO (LA CAPILLA)",3185,"ECUADOR LOJA MACARÁ SABIANGO (LA CAPILLA)","1,12,3185 3249","593 11 08 53",NULL,NULL
3250,50,8,"MACARÁ, CABECERA CANTONAL",3185,"ECUADOR LOJA MACARÁ MACARÁ, CABECERA CANTONAL","1,12,3185 3250","593 11 08 50",NULL,NULL
3251,01,4,"GENERAL ELOY ALFARO (SAN SEBASTIÁN) ",3185,"ECUADOR LOJA MACARÁ GENERAL ELOY ALFARO (SAN SEBASTIÁN) ","1,12,3185 3251","593 11 08 01",NULL,NULL
3252,51,5,LARAMA,3185,"ECUADOR LOJA MACARÁ LARAMA","1,12,3185 3252","593 11 08 51",NULL,NULL
3253,52,5,"LA VICTORIA",3185,"ECUADOR LOJA MACARÁ LA VICTORIA","1,12,3185 3253","593 11 08 52",NULL,NULL
3254,02,4,"MACARÁ  (MANUEL ENRIQUE RENGEL SUQUILANDA)",3185,"ECUADOR LOJA MACARÁ MACARÁ  (MANUEL ENRIQUE RENGEL SUQUILANDA)","1,12,3185 3254","593 11 08 02",NULL,NULL
3255,50,8,"CATACOCHA, CABECERA CANTONAL",3186,"ECUADOR LOJA PALTAS CATACOCHA, CABECERA CANTONAL","1,12,3186 3255","593 11 09 50",NULL,NULL
3256,01,4,CATACOCHA,3186,"ECUADOR LOJA PALTAS CATACOCHA","1,12,3186 3256","593 11 09 01",NULL,NULL
3257,02,4,LOURDES,3186,"ECUADOR LOJA PALTAS LOURDES","1,12,3186 3257","593 11 09 02",NULL,NULL
3258,52,5,GUACHANAMÁ,3186,"ECUADOR LOJA PALTAS GUACHANAMÁ","1,12,3186 3258","593 11 09 52",NULL,NULL
3259,51,5,CANGONAMÁ,3186,"ECUADOR LOJA PALTAS CANGONAMÁ","1,12,3186 3259","593 11 09 51",NULL,NULL
3260,54,5,"LAURO GUERRERO",3186,"ECUADOR LOJA PALTAS LAURO GUERRERO","1,12,3186 3260","593 11 09 54",NULL,NULL
3261,57,5,"SAN ANTONIO",3186,"ECUADOR LOJA PALTAS SAN ANTONIO","1,12,3186 3261","593 11 09 57",NULL,NULL
3262,59,5,YAMANA,3186,"ECUADOR LOJA PALTAS YAMANA","1,12,3186 3262","593 11 09 59",NULL,NULL
3263,58,5,CASANGA,3186,"ECUADOR LOJA PALTAS CASANGA","1,12,3186 3263","593 11 09 58",NULL,NULL
3264,56,5,ORIANGA,3186,"ECUADOR LOJA PALTAS ORIANGA","1,12,3186 3264","593 11 09 56",NULL,NULL
3265,50,8,"ALAMOR, CABECERA CANTONAL",3187,"ECUADOR LOJA PUYANGO ALAMOR, CABECERA CANTONAL","1,12,3187 3265","593 11 10 50",NULL,NULL
3266,51,5,CIANO,3187,"ECUADOR LOJA PUYANGO CIANO","1,12,3187 3266","593 11 10 51",NULL,NULL
3267,52,5,"EL ARENAL",3187,"ECUADOR LOJA PUYANGO EL ARENAL","1,12,3187 3267","593 11 10 52",NULL,NULL
3268,53,5,"EL LIMO (MARIANA DE JESÚS)",3187,"ECUADOR LOJA PUYANGO EL LIMO (MARIANA DE JESÚS)","1,12,3187 3268","593 11 10 53",NULL,NULL
3269,55,5,VICENTINO,3187,"ECUADOR LOJA PUYANGO VICENTINO","1,12,3187 3269","593 11 10 55",NULL,NULL
3270,54,5,MERCADILLO,3187,"ECUADOR LOJA PUYANGO MERCADILLO","1,12,3187 3270","593 11 10 54",NULL,NULL
3271,51,5,"EL PARAÍSO DE CELÉN",3188,"ECUADOR LOJA SARAGURO EL PARAÍSO DE CELÉN","1,12,3188 3271","593 11 11 51",NULL,NULL
3272,53,5,LLUZHAPA,3188,"ECUADOR LOJA SARAGURO LLUZHAPA","1,12,3188 3272","593 11 11 53",NULL,NULL
3273,54,5,MANÚ,3188,"ECUADOR LOJA SARAGURO MANÚ","1,12,3188 3273","593 11 11 54",NULL,NULL
3274,55,5,"SAN ANTONIO DE QUMBE (CUMBE)",3188,"ECUADOR LOJA SARAGURO SAN ANTONIO DE QUMBE (CUMBE)","1,12,3188 3274","593 11 11 55",NULL,NULL
3275,52,5,"EL TABLÓN  ",3188,"ECUADOR LOJA SARAGURO EL TABLÓN  ","1,12,3188 3275","593 11 11 52",NULL,NULL
3276,59,5,"URDANETA (PAQUISHAPA)",3188,"ECUADOR LOJA SARAGURO URDANETA (PAQUISHAPA)","1,12,3188 3276","593 11 11 59",NULL,NULL
3277,60,5,SUMAYPAMBA,3188,"ECUADOR LOJA SARAGURO SUMAYPAMBA","1,12,3188 3277","593 11 11 60",NULL,NULL
3278,56,5,"SAN PABLO DE TENTA",3188,"ECUADOR LOJA SARAGURO SAN PABLO DE TENTA","1,12,3188 3278","593 11 11 56",NULL,NULL
3279,50,8,"SARAGURO, CABECERA CANTONAL",3188,"ECUADOR LOJA SARAGURO SARAGURO, CABECERA CANTONAL","1,12,3188 3279","593 11 11 50",NULL,NULL
3280,58,5,"SELVA ALEGRE",3188,"ECUADOR LOJA SARAGURO SELVA ALEGRE","1,12,3188 3280","593 11 11 58",NULL,NULL
3281,57,5,"SAN SEBASTIÁN DE YÚLUC",3188,"ECUADOR LOJA SARAGURO SAN SEBASTIÁN DE YÚLUC","1,12,3188 3281","593 11 11 57",NULL,NULL
3282,52,5,TACAMOROS,3189,"ECUADOR LOJA SOZORANGA TACAMOROS","1,12,3189 3282","593 11 12 52",NULL,NULL
3283,51,5,"NUEVA FÁTIMA",3189,"ECUADOR LOJA SOZORANGA NUEVA FÁTIMA","1,12,3189 3283","593 11 12 51",NULL,NULL
3284,50,8,"SOZORANGA, CABECERA CANTONAL",3189,"ECUADOR LOJA SOZORANGA SOZORANGA, CABECERA CANTONAL","1,12,3189 3284","593 11 12 50",NULL,NULL
3285,50,8,"ZAPOTILLO, CABECERA CANTONAL",3190,"ECUADOR LOJA ZAPOTILLO ZAPOTILLO, CABECERA CANTONAL","1,12,3190 3285","593 11 13 50",NULL,NULL
3286,54,5,PALETILLAS,3190,"ECUADOR LOJA ZAPOTILLO PALETILLAS","1,12,3190 3286","593 11 13 54",NULL,NULL
3287,55,5,BOLASPAMBA,3190,"ECUADOR LOJA ZAPOTILLO BOLASPAMBA","1,12,3190 3287","593 11 13 55",NULL,NULL
3288,53,5,LIMONES,3190,"ECUADOR LOJA ZAPOTILLO LIMONES","1,12,3190 3288","593 11 13 53",NULL,NULL
3289,51,5,MANGAHURCO,3190,"ECUADOR LOJA ZAPOTILLO MANGAHURCO","1,12,3190 3289","593 11 13 51",NULL,NULL
3290,56,5,CAZADEROS,3190,"ECUADOR LOJA ZAPOTILLO CAZADEROS","1,12,3190 3290","593 11 13 56",NULL,NULL
3291,52,5,GARZAREAL,3190,"ECUADOR LOJA ZAPOTILLO GARZAREAL","1,12,3190 3291","593 11 13 52",NULL,NULL
3292,53,5,MILAGROS,3191,"ECUADOR LOJA PINDAL MILAGROS","1,12,3191 3292","593 11 14 53",NULL,NULL
3293,51,5,CHAQUINAL,3191,"ECUADOR LOJA PINDAL CHAQUINAL","1,12,3191 3293","593 11 14 51",NULL,NULL
3294,52,5,"12 DE DICIEMBRE (CAB.EN ACHIOTES)",3191,"ECUADOR LOJA PINDAL 12 DE DICIEMBRE (CAB.EN ACHIOTES)","1,12,3191 3294","593 11 14 52",NULL,NULL
3295,50,8,"PINDAL, CABECERA CANTONAL",3191,"ECUADOR LOJA PINDAL PINDAL, CABECERA CANTONAL","1,12,3191 3295","593 11 14 50",NULL,NULL
3296,51,5,FUNDOCHAMBA,3192,"ECUADOR LOJA QUILANGA FUNDOCHAMBA","1,12,3192 3296","593 11 15 51",NULL,NULL
3297,52,5,"SAN ANTONIO DE LAS ARADAS (CAB. EN LAS ARADAS)",3192,"ECUADOR LOJA QUILANGA SAN ANTONIO DE LAS ARADAS (CAB. EN LAS ARADAS)","1,12,3192 3297","593 11 15 52",NULL,NULL
3298,50,8,"QUILANGA, CABECERA CANTONAL",3192,"ECUADOR LOJA QUILANGA QUILANGA, CABECERA CANTONAL","1,12,3192 3298","593 11 15 50",NULL,NULL
3299,51,5,"LA TINGUE",3193,"ECUADOR LOJA OLMEDO LA TINGUE","1,12,3193 3299","593 11 16 51",NULL,NULL
3300,50,8,"OLMEDO, CABECERA CANTONAL",3193,"ECUADOR LOJA OLMEDO OLMEDO, CABECERA CANTONAL","1,12,3193 3300","593 11 16 50",NULL,NULL
3301,01,3,"MORONA ",15,"ECUADOR MORONA SANTIAGO MORONA ","1,15,3301","593 14 01",NULL,NULL
3302,02,3,"GUALAQUIZA ",15,"ECUADOR MORONA SANTIAGO GUALAQUIZA ","1,15,3302","593 14 02",NULL,NULL
3303,03,3,"LIMÓN INDANZA ",15,"ECUADOR MORONA SANTIAGO LIMÓN INDANZA ","1,15,3303","593 14 03",NULL,NULL
3304,04,3,"PALORA ",15,"ECUADOR MORONA SANTIAGO PALORA ","1,15,3304","593 14 04",NULL,NULL
3305,05,3,"SANTIAGO ",15,"ECUADOR MORONA SANTIAGO SANTIAGO ","1,15,3305","593 14 05",NULL,NULL
3306,06,3,"SUCÚA  ",15,"ECUADOR MORONA SANTIAGO SUCÚA ","1,15,3306","593 14 06",NULL,NULL
3307,07,3,HUAMBOYA,15,"ECUADOR MORONA SANTIAGO HUAMBOYA","1,15,3307","593 14 07",NULL,NULL
3308,08,3,"SAN JUAN BOSCO",15,"ECUADOR MORONA SANTIAGO SAN JUAN BOSCO","1,15,3308","593 14 08",NULL,NULL
3309,09,3,TAISHA,15,"ECUADOR MORONA SANTIAGO TAISHA","1,15,3309","593 14 09",NULL,NULL
3310,10,3,LOGROÑO,15,"ECUADOR MORONA SANTIAGO LOGROÑO","1,15,3310","593 14 10",NULL,NULL
3311,11,3,"PABLO SEXTO",15,"ECUADOR MORONA SANTIAGO PABLO SEXTO","1,15,3311","593 14 11",NULL,NULL
3312,12,3,TIWINTZA,15,"ECUADOR MORONA SANTIAGO TIWINTZA","1,15,3312","593 14 12",NULL,NULL
3313,51,5,"ALSHI (CAB. EN 9 DE OCTUBRE) ",3301,"ECUADOR MORONA SANTIAGO MORONA ALSHI (CAB. EN 9 DE OCTUBRE) ","1,15,3301,3313","593 14 01 51",NULL,NULL
3314,57,5,"SEVILLA DON BOSCO",3301,"ECUADOR MORONA SANTIAGO MORONA SEVILLA DON BOSCO","1,15,3301,3314","593 14 01 57",NULL,NULL
3315,56,5,"SAN ISIDRO",3301,"ECUADOR MORONA SANTIAGO MORONA SAN ISIDRO","1,15,3301,3315","593 14 01 56",NULL,NULL
3316,50,8,"MACAS, CABECERA CANTONAL Y CAPITAL PROVINCIAL 			",3301,"ECUADOR MORONA SANTIAGO MORONA MACAS, CABECERA CANTONAL Y CAPITAL PROVINCIAL 			","1,15,3301,3316","593 14 01 50",NULL,NULL
3317,53,5,"GENERAL PROAÑO",3301,"ECUADOR MORONA SANTIAGO MORONA GENERAL PROAÑO","1,15,3301,3317","593 14 01 53",NULL,NULL
3318,64,5,"RÍO BLANCO",3301,"ECUADOR MORONA SANTIAGO MORONA RÍO BLANCO","1,15,3301,3318","593 14 01 64",NULL,NULL
3319,62,5,CUCHAENTZA,3301,"ECUADOR MORONA SANTIAGO MORONA CUCHAENTZA","1,15,3301,3319","593 14 01 62",NULL,NULL
3320,60,5,"ZUÑA (ZÚÑAC)",3301,"ECUADOR MORONA SANTIAGO MORONA ZUÑA (ZÚÑAC)","1,15,3301,3320","593 14 01 60",NULL,NULL
3321,58,5,SINAÍ,3301,"ECUADOR MORONA SANTIAGO MORONA SINAÍ","1,15,3301,3321","593 14 01 58",NULL,NULL
3322,51,5,"AMAZONAS (ROSARIO DE CUYES) ",3302,"ECUADOR MORONA SANTIAGO GUALAQUIZA AMAZONAS (ROSARIO DE CUYES) ","1,15,3302 3322","593 14 02 51",NULL,NULL
3323,02,4,"MERCEDES MOLINA",3302,"ECUADOR MORONA SANTIAGO GUALAQUIZA MERCEDES MOLINA","1,15,3302 3323","593 14 02 02",NULL,NULL
3324,50,8,"GUALAQUIZA, CABECERA CANTONAL",3302,"ECUADOR MORONA SANTIAGO GUALAQUIZA GUALAQUIZA, CABECERA CANTONAL","1,15,3302 3324","593 14 02 50",NULL,NULL
3325,52,5,BERMEJOS,3302,"ECUADOR MORONA SANTIAGO GUALAQUIZA BERMEJOS","1,15,3302 3325","593 14 02 52",NULL,NULL
3326,01,4,GUALAQUIZA,3302,"ECUADOR MORONA SANTIAGO GUALAQUIZA GUALAQUIZA","1,15,3302 3326","593 14 02 01",NULL,NULL
3327,55,5,"EL ROSARIO",3302,"ECUADOR MORONA SANTIAGO GUALAQUIZA EL ROSARIO","1,15,3302 3327","593 14 02 55",NULL,NULL
3328,54,5,CHIGÜINDA,3302,"ECUADOR MORONA SANTIAGO GUALAQUIZA CHIGÜINDA","1,15,3302 3328","593 14 02 54",NULL,NULL
3329,57,5,"SAN MIGUEL DE CUYES",3302,"ECUADOR MORONA SANTIAGO GUALAQUIZA SAN MIGUEL DE CUYES","1,15,3302 3329","593 14 02 57",NULL,NULL
3330,56,5,"NUEVA TARQUI",3302,"ECUADOR MORONA SANTIAGO GUALAQUIZA NUEVA TARQUI","1,15,3302 3330","593 14 02 56",NULL,NULL
3331,53,5,BOMBOIZA,3302,"ECUADOR MORONA SANTIAGO GUALAQUIZA BOMBOIZA","1,15,3302 3331","593 14 02 53",NULL,NULL
3332,58,5,"EL IDEAL",3302,"ECUADOR MORONA SANTIAGO GUALAQUIZA EL IDEAL","1,15,3302 3332","593 14 02 58",NULL,NULL
3333,53,5,"SAN ANTONIO (CAB. EN SAN ANTONIO CENTRO)",3303,"ECUADOR MORONA SANTIAGO LIMÓN INDANZA SAN ANTONIO (CAB. EN SAN ANTONIO CENTRO)","1,15,3303,3333","593 14 03 53",NULL,NULL
3334,51,5,INDANZA,3303,"ECUADOR MORONA SANTIAGO LIMÓN INDANZA INDANZA","1,15,3303,3334","593 14 03 51",NULL,NULL
3335,50,8,"GENERAL LEONIDAS PLAZA GUTIÉRREZ (LIMÓN), CABECERA CANTONAL				",3303,"ECUADOR MORONA SANTIAGO LIMÓN INDANZA GENERAL LEONIDAS PLAZA GUTIÉRREZ (LIMÓN), CABECERA CANTONAL				","1,15,3303,3335","593 14 03 50",NULL,NULL
3336,56,5,"SAN MIGUEL DE CONCHAY",3303,"ECUADOR MORONA SANTIAGO LIMÓN INDANZA SAN MIGUEL DE CONCHAY","1,15,3303,3336","593 14 03 56",NULL,NULL
3337,57,5,"SANTA SUSANA DE CHIVIAZA (CAB. EN CHIVIAZA)",3303,"ECUADOR MORONA SANTIAGO LIMÓN INDANZA SANTA SUSANA DE CHIVIAZA (CAB. EN CHIVIAZA)","1,15,3303,3337","593 14 03 57",NULL,NULL
3338,58,5,"YUNGANZA (CAB. EN EL ROSARIO)",3303,"ECUADOR MORONA SANTIAGO LIMÓN INDANZA YUNGANZA (CAB. EN EL ROSARIO)","1,15,3303,3338","593 14 03 58",NULL,NULL
3339,55,5,"16 DE AGOSTO",3304,"ECUADOR MORONA SANTIAGO PALORA 16 DE AGOSTO","1,15,3304,3339","593 14 04 55",NULL,NULL
3340,51,5,ARAPICOS,3304,"ECUADOR MORONA SANTIAGO PALORA ARAPICOS","1,15,3304,3340","593 14 04 51",NULL,NULL
3341,52,5,"CUMANDÁ (CAB. EN COLONIA AGRÍCOLA SEVILLA DEL ORO)",3304,"ECUADOR MORONA SANTIAGO PALORA CUMANDÁ (CAB. EN COLONIA AGRÍCOLA SEVILLA DEL ORO)","1,15,3304,3341","593 14 04 52",NULL,NULL
3342,54,5,"SANGAY (CAB. EN NAYAMANACA)",3304,"ECUADOR MORONA SANTIAGO PALORA SANGAY (CAB. EN NAYAMANACA)","1,15,3304,3342","593 14 04 54",NULL,NULL
3343,50,8,"PALORA (METZERA),CABECERA CANTONAL",3304,"ECUADOR MORONA SANTIAGO PALORA PALORA (METZERA),CABECERA CANTONAL","1,15,3304,3343","593 14 04 50",NULL,NULL
3344,51,5,COPAL,3305,"ECUADOR MORONA SANTIAGO SANTIAGO COPAL","1,15,3305,3344","593 14 05 51",NULL,NULL
3345,50,8,"SANTIAGO DE MÉNDEZ, CABECERA CANTONAL",3305,"ECUADOR MORONA SANTIAGO SANTIAGO SANTIAGO DE MÉNDEZ, CABECERA CANTONAL","1,15,3305,3345","593 14 05 50",NULL,NULL
3346,53,5,PATUCA,3305,"ECUADOR MORONA SANTIAGO SANTIAGO PATUCA","1,15,3305,3346","593 14 05 53",NULL,NULL
3347,57,5,"SAN FRANCISCO DE CHINIMBIMI",3305,"ECUADOR MORONA SANTIAGO SANTIAGO SAN FRANCISCO DE CHINIMBIMI","1,15,3305,3347","593 14 05 57",NULL,NULL
3348,54,5,"SAN LUIS DE EL ACHO (CAB. EN EL ACHO) ",3305,"ECUADOR MORONA SANTIAGO SANTIAGO SAN LUIS DE EL ACHO (CAB. EN EL ACHO) ","1,15,3305,3348","593 14 05 54",NULL,NULL
3349,56,5,TAYUZA,3305,"ECUADOR MORONA SANTIAGO SANTIAGO TAYUZA","1,15,3305,3349","593 14 05 56",NULL,NULL
3350,52,5,CHUPIANZA,3305,"ECUADOR MORONA SANTIAGO SANTIAGO CHUPIANZA","1,15,3305,3350","593 14 05 52",NULL,NULL
3351,55,5,"SANTA MARIANITA DE JESÚS",3306,"ECUADOR MORONA SANTIAGO SUCÚA SANTA MARIANITA DE JESÚS","1,15,3306,3351","593 14 06 55",NULL,NULL
3352,52,5,HUAMBI,3306,"ECUADOR MORONA SANTIAGO SUCÚA HUAMBI","1,15,3306,3352","593 14 06 52",NULL,NULL
3353,51,5,ASUNCIÓN,3306,"ECUADOR MORONA SANTIAGO SUCÚA ASUNCIÓN","1,15,3306,3353","593 14 06 51",NULL,NULL
3354,50,8,"SUCÚA, CABECERA CANTONAL",3306,"ECUADOR MORONA SANTIAGO SUCÚA SUCÚA, CABECERA CANTONAL","1,15,3306,3354","593 14 06 50",NULL,NULL
3355,51,5,CHIGUAZA,3307,"ECUADOR MORONA SANTIAGO HUAMBOYA CHIGUAZA","1,15,3307,3355","593 14 07 51",NULL,NULL
3356,50,8,"HUAMBOYA, CABECERA CANTONAL",3307,"ECUADOR MORONA SANTIAGO HUAMBOYA HUAMBOYA, CABECERA CANTONAL","1,15,3307,3356","593 14 07 50",NULL,NULL
3357,50,8,"SAN JUAN BOSCO, CABECERA CANTONAL",3308,"ECUADOR MORONA SANTIAGO SAN JUAN BOSCO SAN JUAN BOSCO, CABECERA CANTONAL","1,15,3308,3357","593 14 08 50",NULL,NULL
3358,53,5,"SAN JACINTO DE WAKAMBEIS ",3308,"ECUADOR MORONA SANTIAGO SAN JUAN BOSCO SAN JACINTO DE WAKAMBEIS ","1,15,3308,3358","593 14 08 53",NULL,NULL
3359,54,5,"SANTIAGO DE PANANZA",3308,"ECUADOR MORONA SANTIAGO SAN JUAN BOSCO SANTIAGO DE PANANZA","1,15,3308,3359","593 14 08 54",NULL,NULL
3360,52,5,"SAN CARLOS DE LIMÓN  ",3308,"ECUADOR MORONA SANTIAGO SAN JUAN BOSCO SAN CARLOS DE LIMÓN  ","1,15,3308,3360","593 14 08 52",NULL,NULL
3361,51,5,"PAN DE AZÚCAR",3308,"ECUADOR MORONA SANTIAGO SAN JUAN BOSCO PAN DE AZÚCAR","1,15,3308,3361","593 14 08 51",NULL,NULL
3362,54,5,PUMPUENTSA,3309,"ECUADOR MORONA SANTIAGO TAISHA PUMPUENTSA","1,15,3309,3362","593 14 09 54",NULL,NULL
3363,53,5,"TUUTINENTZA ",3309,"ECUADOR MORONA SANTIAGO TAISHA TUUTINENTZA ","1,15,3309,3363","593 14 09 53",NULL,NULL
3364,50,8,"TAISHA, CABECERA CANTONAL",3309,"ECUADOR MORONA SANTIAGO TAISHA TAISHA, CABECERA CANTONAL","1,15,3309,3364","593 14 09 50",NULL,NULL
3365,52,5,"MACUMA  ",3309,"ECUADOR MORONA SANTIAGO TAISHA MACUMA  ","1,15,3309,3365","593 14 09 52",NULL,NULL
3366,51,5,"HUASAGA (CAB. EN WAMPUIK) ",3309,"ECUADOR MORONA SANTIAGO TAISHA HUASAGA (CAB. EN WAMPUIK) ","1,15,3309,3366","593 14 09 51",NULL,NULL
3367,51,5,YAUPI,3310,"ECUADOR MORONA SANTIAGO LOGROÑO YAUPI","1,15,3310,3367","593 14 10 51",NULL,NULL
3368,50,8,"LOGROÑO, CABECERA CANTONAL",3310,"ECUADOR MORONA SANTIAGO LOGROÑO LOGROÑO, CABECERA CANTONAL","1,15,3310,3368","593 14 10 50",NULL,NULL
3369,52,5,SHIMPIS,3310,"ECUADOR MORONA SANTIAGO LOGROÑO SHIMPIS","1,15,3310,3369","593 14 10 52",NULL,NULL
3370,50,8,"PABLO SEXTO, CABECERA CANTONAL",3311,"ECUADOR MORONA SANTIAGO PABLO SEXTO PABLO SEXTO, CABECERA CANTONAL","1,15,3311,3370","593 14 11 50",NULL,NULL
3371,50,8,"SANTIAGO, CABECERA CANTONAL",3312,"ECUADOR MORONA SANTIAGO TIWINTZA SANTIAGO, CABECERA CANTONAL","1,15,3312,3371","593 14 12 50",NULL,NULL
3372,51,5,"SAN JOSÉ DE MORONA",3312,"ECUADOR MORONA SANTIAGO TIWINTZA SAN JOSÉ DE MORONA","1,15,3312,3372","593 14 12 51",NULL,NULL
3373,01,3,TENA,16,"ECUADOR NAPO TENA  ","1,16,3373","593 15 01",NULL,NULL
3374,03,3,"ARCHIDONA ",16,"ECUADOR NAPO ARCHIDONA ","1,16,3374","593 15 03",NULL,NULL
3375,04,3,"EL CHACO",16,"ECUADOR NAPO EL CHACO","1,16,3375","593 15 04",NULL,NULL
3376,07,3,QUIJOS,16,"ECUADOR NAPO QUIJOS","1,16,3376","593 15 07",NULL,NULL
3377,09,3,"CARLOS JULIO AROSEMENA TOLA",16,"ECUADOR NAPO CARLOS JULIO AROSEMENA TOLA","1,16,3377","593 15 09",NULL,NULL
3378,50,8,"TENA, CABECERA CANTONAL Y CAPITAL PROVINCIAL			",3373,"ECUADOR NAPO TENA TENA, CABECERA CANTONAL Y CAPITAL PROVINCIAL			","1,16,3373,3378","593 15 01 50",NULL,NULL
3379,51,5,AHUANO,3373,"ECUADOR NAPO TENA AHUANO","1,16,3373,3379","593 15 01 51",NULL,NULL
3380,53,5,CHONTAPUNTA,3373,"ECUADOR NAPO TENA CHONTAPUNTA","1,16,3373,3380","593 15 01 53",NULL,NULL
3381,54,5,PANO,3373,"ECUADOR NAPO TENA PANO","1,16,3373,3381","593 15 01 54",NULL,NULL
3382,58,5,"SAN JUAN DE MUYUNA",3373,"ECUADOR NAPO TENA SAN JUAN DE MUYUNA","1,16,3373,3382","593 15 01 58",NULL,NULL
3383,55,5,"PUERTO MISAHUALLI",3373,"ECUADOR NAPO TENA PUERTO MISAHUALLI","1,16,3373,3383","593 15 01 55",NULL,NULL
3384,57,5,TÁLAG,3373,"ECUADOR NAPO TENA TÁLAG","1,16,3373,3384","593 15 01 57",NULL,NULL
3385,56,5,"PUERTO NAPO",3373,"ECUADOR NAPO TENA PUERTO NAPO","1,16,3373,3385","593 15 01 56",NULL,NULL
3386,50,8,"ARCHIDONA, CABECERA CANTONAL",3374,"ECUADOR NAPO ARCHIDONA ARCHIDONA, CABECERA CANTONAL","1,16,3374,3386","593 15 03 50",NULL,NULL
3387,54,5,"SAN PABLO DE USHPAYACU",3374,"ECUADOR NAPO ARCHIDONA SAN PABLO DE USHPAYACU","1,16,3374,3387","593 15 03 54",NULL,NULL
3388,52,5,COTUNDO,3374,"ECUADOR NAPO ARCHIDONA COTUNDO","1,16,3374,3388","593 15 03 52",NULL,NULL
3389,56,5,"HATUN SUMAKU",3374,"ECUADOR NAPO ARCHIDONA HATUN SUMAKU","1,16,3374,3389","593 15 03 56",NULL,NULL
3390,50,8,"EL CHACO, CABECERA CANTONAL",3375,"ECUADOR NAPO EL CHACO EL CHACO, CABECERA CANTONAL","1,16,3375,3390","593 15 04 50",NULL,NULL
3391,54,5,"SANTA ROSA",3375,"ECUADOR NAPO EL CHACO SANTA ROSA","1,16,3375,3391","593 15 04 54",NULL,NULL
3392,55,5,SARDINAS,3375,"ECUADOR NAPO EL CHACO SARDINAS","1,16,3375,3392","593 15 04 55",NULL,NULL
3393,52,5,LINARES,3375,"ECUADOR NAPO EL CHACO LINARES","1,16,3375,3393","593 15 04 52",NULL,NULL
3394,53,5,OYACACHI,3375,"ECUADOR NAPO EL CHACO OYACACHI","1,16,3375,3394","593 15 04 53",NULL,NULL
