ID_TERRITORIO,CODIGO,ID_NIVEL_TERRITORIAL,DESCRIPCION,ID_TERRITORIO_PADRE,PATH_DESCRIPCION,PATH_ID,PATH_CODIGO,NOMECLATURA,PATH_NOMECLATURA
1,593,1,ECUADOR,-1,ECUADOR,1,593,EC,EC
2,01,2,AZUAY,1,"ECUADOR AZUAY","1,2","593 01",NULL,NULL
3,02,2,BOLIVAR,1,"ECUADOR BOLIVAR","1,3","593 02",NULL,NULL
4,03,2,CAÑAR,1,"ECUADOR CAÑAR","1,4","593 03",NULL,NULL
5,04,2,CARCHI,1,"ECUADOR CARCHI","1,5","593 04",NULL,NULL
6,05,2,COTOPAXI,1,"ECUADOR COTOPAXI","1,6","593 05",NULL,NULL
7,06,2,CHIMBORAZO,1,"ECUADOR CHIMBORAZO","1,7","593 06",NULL,NULL
8,07,2,"EL ORO",1,"ECUADOR EL ORO","1,8","593 07",NULL,NULL
9,08,2,ESMERALDAS,1,"ECUADOR ESMERALDAS","1,9","593 08",ESM,"EC ESM"
10,09,2,GUAYAS,1,"ECUADOR GUAYAS","1,10","593 09",NULL,NULL
11,10,2,IMBABURA,1,"ECUADOR IMBABURA","1,11","593 10",NULL,NULL
12,11,2,LOJA,1,"ECUADOR LOJA","1,12","593 11",NULL,NULL
13,12,2,"LOS RIOS",1,"ECUADOR LOS RIOS","1,13","593 12",NULL,NULL
14,13,2,MANABI,1,"ECUADOR MANABI","1,14","593 13",MAN,"EC MAN"
15,14,2,"MORONA SANTIAGO",1,"ECUADOR MORONA SANTIAGO","1,15","593 14",NULL,NULL
16,15,2,NAPO,1,"ECUADOR NAPO","1,16","593 15",NULL,NULL
17,16,2,PASTAZA,1,"ECUADOR PASTAZA","1,17","593 16",NULL,NULL
18,17,2,PICHINCHA,1,"ECUADOR PICHINCHA","1,18","593 17",NULL,NULL
19,18,2,TUNGURAHUA,1,"ECUADOR TUNGURAHUA","1,19","593 18",NULL,NULL
20,19,2,"ZAMORA CHINCHIPE",1,"ECUADOR ZAMORA CHINCHIPE","1,20","593 19",NULL,NULL
21,20,2,GALAPAGOS,1,"ECUADOR GALAPAGOS","1,21","593 20",NULL,NULL
22,21,2,SUCUMBIOS,1,"ECUADOR SUCUMBIOS","1,22","593 21",NULL,NULL
23,22,2,ORELLANA,1,"ECUADOR ORELLANA","1,23","593 22",NULL,NULL
33,01,3,PORTOVIEJO,14,"ECUADOR MANABI PORTOVIEJO","1,14,33","593 13 01",POR,"EC MAN POR"
34,02,3,"BOLIVAR DE MANABI",14,"ECUADOR MANABI BOLIVAR","1,14,34","593 13 02",BOL,"EC MAN BOL"
35,03,3,CHONE,14,"ECUADOR MANABI CHONE","1,14,35","593 13 03",CHO,"EC MAN CHO"
36,04,3,"EL CARMEN",14,"ECUADOR MANABI EL CARMEN","1,14,36","593 13 04",CAR,"EC MAN CAR"
37,05,3,"FLAVIO ALFARO",14,"ECUADOR MANABI FLAVIO ALFARO","1,14,37","593 13 05",FAL,"EC MAN FAL"
38,06,3,JIPIJAPA,14,"ECUADOR MANABI JIPIJAPA","1,14,38","593 13 06",JIP,"EC MAN JIP"
39,07,3,JUNIN,14,"ECUADOR MANABI JUNIN","1,14,39","593 13 07",JUN,"EC MAN JIP"
40,08,3,MANTA,14,"ECUADOR MANABI MANTA","1,14,40","593 13 08",MAN,"EC MAN MAN"
41,09,3,MONTECRISTI,14,"ECUADOR MANABI MONTECRISTI","1,14,41","593 13 09",MON,"EC MAN MON"
42,10,3,PAJAN,14,"ECUADOR MANABI PAJAN","1,14,42","593 13 10",PAJ,"EC MAN PAJ"
43,11,3,PICHINCHA,14,"ECUADOR MANABI PICHINCHA","1,14,43","593 13 11",PIC,"EC MAN PIC"
44,12,3,ROCAFUERTE,14,"ECUADOR MANABI ROCAFUERTE","1,14,44","593 13 12",ROC,"EC MAN ROC"
45,13,3,"SANTA ANA",14,"ECUADOR MANABI SANTA ANA","1,14,45","593 13 13",SAN,"EC MAN SAN"
46,14,3,SUCRE,14,"ECUADOR MANABI SUCRE","1,14,46","593 13 14",SUC,"EC MAN SUC"
47,15,3,TOSAGUA,14,"ECUADOR MANABI TOSAGUA","1,14,47","593 13 15",TOS,"EC MAN TOS"
48,16,3,"VEINTICUATRO DE MAYO",14,"ECUADOR MANABI VEINTICUATRO DE MAYO","1,14,48","593 13 16",24M,"EC MAN 24M"
49,17,3,PEDERNALES,14,"ECUADOR MANABI PEDERNALES","1,14,49","593 13 17",PED,"EC MAN PED"
50,18,3,OLMEDO,14,"ECUADOR MANABI OLMEDO","1,14,50","593 13 18",OLM,"EC MAN OLM"
51,19,3,"PUERTO LOPEZ",14,"ECUADOR MANABI PUERTO LOPEZ","1,14,51","593 13 19",PLO,"EC MAN PLO"
52,20,3,JAMA,14,"ECUADOR MANABI JAMA","1,14,52","593 13 20",JAM,"EC MAN JAM"
53,21,3,JARAMIJO,14,"ECUADOR MANABI JARAMIJO","1,14,53","593 13 21",JAR,"EC MAN JAR"
54,22,3,"SAN VICENTE",14,"ECUADOR MANABI SAN VICENTE","1,14,54","593 13 22",SVI,"EC MAN SVI"
55,01,3,GUAYAQUIL,10,"ECUADOR GUAYAS GUAYAQUIL","1,10,55","593 09 01",UYE,"EC GUY UYE"
64,01,4,PORTOVIEJO,33,"ECUADOR MANABI PORTOVIEJO PORTOVIEJO","1,14,33,64","593 13 01 01",POR,"EC MAN POR POR"
65,02,4,"12 DE MARZO",33,"ECUADOR MANABI PORTOVIEJO 12 DE MARZO","1,14,33,65","593 13 01 02",12M,"EC MAN POR 12M"
66,03,4,COLON,33,"ECUADOR MANABI PORTOVIEJO COLON","1,14,33,66","593 13 01 03",COL,"EC MAN POR COL"
67,04,4,PICOAZA,33,"ECUADOR MANABI PORTOVIEJO PICOAZA","1,14,33,67","593 13 01 04",PIC,"EC MAN POR PIC"
68,05,4,"SAN PABLO",33,"ECUADOR MANABI PORTOVIEJO SAN PABLO","1,14,33,68","593 13 01 05",SPA,"EC MAN POR SPA"
69,06,4,"ANDRES DE VERA",33,"ECUADOR MANABI PORTOVIEJO ANDRES DE VERA","1,14,33,69","593 13 01 06",ADV,"EC MAN POR ADV"
70,07,4,"FRANCISCO PACHECO",33,"ECUADOR MANABI PORTOVIEJO FRANCISCO PACHECO","1,14,33,70","593 13 01 07",FPA,"EC MAN POR FPA"
71,08,4,"18 DE OCTUBRE",33,"ECUADOR MANABI PORTOVIEJO 18 DE OCTUBRE","1,14,33,71","593 13 01 08",18O,"EC MAN POR 18O"
72,09,4,"SIMON BOLIVAR",33,"ECUADOR MANABI PORTOVIEJO SIMON BOLIVAR","1,14,33,72","593 13 01 09",SBO,"EC MAN POR SBO"
73,51,5,"ABDON CALDERON (SAN FRANSISCO)",33,"ECUADOR MANABI PORTOVIEJO ABDON CALDERON","1,14,33,73","593 13 01 51",ACA,"EC MAN POR ACA"
74,52,5,ALHAJUELA,33,"ECUADOR MANABI PORTOVIEJO ALHAJUELA","1,14,33,74","593 13 01 52",ALH,"EC MAN POR ALH"
75,53,5,CRUCITA,33,"ECUADOR MANABI PORTOVIEJO CRUCITA","1,14,33,75","593 13 01 53",CRU,"EC MAN POR CRU"
76,54,5,"PUEBLO NUEVO",33,"ECUADOR MANABI PORTOVIEJO PUEBLO NUEVO","1,14,33,76","593 13 01 54",PNU,"EC MAN POR PNU"
77,55,5,RIOCHICO,33,"ECUADOR MANABI PORTOVIEJO RIOCHICO","1,14,33,77","593 13 01 55",RCH,"EC MAN POR RCH"
78,56,5,"SAN PLACIDO",33,"ECUADOR MANABI PORTOVIEJO SAN PLACIDO","1,14,33,78","593 13 01 56",SPL,"EC MAN POR SPL"
79,57,5,CHIRIJOS,33,"ECUADOR MANABI PORTOVIEJO CHIRIJOS","1,14,33,79","593 13 01 57",CHI,"EC MAN POR CHI"
80,50,8,"CALCETA, CABECERA CANTONAL",34,"ECUADOR MANABI BOLIVAR CALCETA","1,14,34,80","593 13 02 50",CAL,"EC MAN BOL CAL"
81,51,5,MEMBRILLO,34,"ECUADOR MANABI BOLIVAR MEMBRILLO","1,14,34,81","593 13 02 51",MEM,"EC MAN BOL MEM"
82,52,5,QUIROGA,34,"ECUADOR MANABI BOLIVAR QUIROGA","1,14,34,82","593 13 02 52",QUI,"EC MAN BOL QUI"
83,01,4,"CHONE ",35,"ECUADOR MANABI CHONE CHONE","1,14,35,83","593 13 03 01",CHO,"EC MAN CHO CHO"
84,02,4,"SANTA RITA",35,"ECUADOR MANABI CHONE SANTA RITA","1,14,35,84","593 13 03 02",SRI,"EC MAN CHO SRI"
85,51,5,BOYACA,35,"ECUADOR MANABI CHONE BOYACA","1,14,35,85","593 13 03 51",BOY,"EC MAN CHO BOY"
86,52,5,CANUTO,35,"ECUADOR MANABI CHONE CANUTO","1,14,35,86","593 13 03 52",CAN,"EC MAN CHO CAN"
87,53,5,CONVENTO,35,"ECUADOR MANABI CHONE CONVENTO","1,14,35,87","593 13 03 53",CON,"EC MAN CHO CON"
88,54,5,CHIBUNGA,35,"ECUADOR MANABI CHONE CHIBUNGA","1,14,35,88","593 13 03 54",CHI,"EC MAN CHO CHI"
89,55,5,"ELOY ALFARO ",35,"ECUADOR MANABI CHONE ELOY ALFARO","1,14,35,89","593 13 03 55",EAL,"EC MAN CHO EAL"
90,56,5,RICAUTE,35,"ECUADOR MANABI CHONE RICAUTE","1,14,35,90","593 13 03 56",RIC,"EC MAN CHO RIC"
91,57,5,"SAN ANTONIO ",35,"ECUADOR MANABI CHONE SAN ANTONIO","1,14,35,91","593 13 03 57",SAN,"EC MAN CHO SAN"
92,01,4,"EL CARMEN",36,"ECUADOR MANABI EL CARMEN EL CARMEN","1,14,35,92","593 13 04 01",ECA,"EC MAN ECA ECA"
93,02,4,"CUATRO DE DICIEMBRE ",36,"ECUADOR MANABI EL CARMEN EL CARMEN","1,14,36,93","593 13 04 02",4DI,"EC MAN ECA 4DI"
94,51,5,"WILFRIDO LOOR MOREIRA",36,"ECUADOR MANABI EL CARMEN WILFRIDO LOOR MOREIRA","1,14,36,94","593 13 04 51",WLM,"EC MAN ECA WLM"
95,52,5,"SAN PEDRO DE SUMA",36,"ECUADOR MANABI EL CARMEN SAN PEDRO DE SUMA","1,14,36,95","593 13 04 52",SPS,"EC MAN ECA SPS"
96,50,5,"FLAVIO ALFARO",37,"ECUADOR MANABI FLAVIO ALFARO FLAVIO ALFARO","1,14,37,96","593 13 05 50",FAL,"EC MAN FAL FAL"
97,51,5,"SAN FRANCISCO DE NOVIL",37,"ECUADOR MANABI FLAVIO ALFARO SAN FRANCISDO DE NOVIL","1,14,37,97","593 13 05 51",SFN,"EC MAN FAL SFN"
98,52,5,ZAPALLO,37,"ECUADOR MANABI FLAVIO ALFARO ZAPALLO","1,14,37,98","593 13 05 52",ZAP,"EC MAN FAL ZAP"
99,01,4,"DR. MIGUEL MORÁN LUCIO",38,"ECUADOR MANABI JIPIJAPA DR. MIGUEL MORÁN LUCIO","1,14,38,99","593 13 06 01",MML,"EC MAN JIP MML"
100,02,4,"MANUEL INOCENCIO PARRALES Y GUALE",38,"ECUADOR MANABI JIPIJAPA MANUEL INOCENCIO PARRALES Y GUALE","1,14,38,100","593 13 06 02",MPG,"EC MAN JIP MPG"
101,03,4,"SAN LORENZO DE JIPIJAPA",38,"ECUADOR MANABI JIPIJAPA SAN LORENZO DE JIPIJAPA","1,14,38,101","593 13 06 03",SLJ,"EC MAN JIP SLJ"
102,51,5,AMERICA,38,"ECUADOR MANABI JIPIJAPA AMERICA","1,14,38,102","593 13 06 51",AME,"EC MAN JIP AME"
103,52,5,"EL ANEGADO (CAB. EN ELOY ALFARO)",38,"ECUADOR MANABI JIPIJAPA EL ANEGADO (CAB. EN ELOY ALFARO)","1,14,38,103","593 13 06 52",EAN,"EC MAN JIP EAN"
104,53,5,JULCUY,38,"ECUADOR MANABI JIPIJAPA JULCUY","1,14,38,104","593 13 06 53",JUL,"EC MAN JIP JUL"
105,54,5,"LA UNION",38,"ECUADOR MANABI JIPIJAPA LA UNION","1,14,38,105","593 13 06 54",LUN,"EC MAN JIP LUN"
107,56,5,MEMBRILLAL,38,"ECUADOR MANABI JIPIJAPA MEMBRILLAL","1,14,38,107","593 13 06 56",MEM,"EC MAN JIP MEM"
108,57,5,"PEDRO PABLO GÓMEZ",38,"ECUADOR MANABI JIPIJAPA PEDRO PABLO GÓMEZ   ","1,14,38,108","593 13 06 57",PPG,"EC MAN JIP PPG"
109,58,5,"PUERTO DE CAYO",38,"ECUADOR MANABI JIPIJAPA PUERTO DE CAYO","1,14,38,109","593 13 06 58",PCA,"EC MAN JIP PCA"
112,50,8,"JUNIN, CABECERA CANTONAL",39,"ECUADOR MANABI JUNIN JUNIN","1,14,39,112","593 13 07 50",JUN,"EC MAN JUN JUN"
113,01,4,"LOS ESTEROS",40,"ECUADOR MANABI MANTA LOS ESTEROS","1,14,40,113","593 13 08 01",LES,"EC MAN MAN LES"
114,02,4,MANTA,40,"ECUADOR MANABI MANTA MANTA","1,14,40,114","593 13 08 02",MAN,"EC MAN MAN MAN"
115,03,4,"SAN MATEO",40,"ECUADOR MANABI MANTA SAN MATEO","1,14,40,115","593 13 08 03",SMA,"EC MAN MAN SMA"
116,04,4,TARQUI,40,"ECUADOR MANABI MANTA TARQUI","1,14,40,116","593 13 08 04",TAR,"EC MAN MAN TAR"
117,05,4,"ELOY ALFARO",40,"ECUADOR MANABI MANTA ELOY ALFARO","1,14,40,117","593 13 08 05",EAL,"EC MAN MAN EAL"
118,06,4,VALDIVIA,40,"ECUADOR MANABI MANTA VALDIVIA","1,14,40,118","593 13 08 06",VAL,"EC MAN MAN VAL"
119,51,5,"SAN LORENZO",40,"ECUADOR MANABI MANTA SAN LORENZO","1,14,40,119","593 13 08 51",SLO,"EC MAN MAN SLO"
120,52,5,"SANTA MARIANITA",40,"ECUADOR MANABI MANTA SANTA MARIANITA","1,14,40,120","593 13 08 52",SMA,"EC MAN MAN SMA"
121,01,4,"ANÍBAL SAN ANDRÉS",41,"ECUADOR MANABI MONTECRISTI ANÍBAL SAN ANDRÉS","1,14,41,121","593 13 09 01",ASA,"EC MAN MON ASA"
122,02,4,MONTECRISTI,41,"ECUADOR MANABI MONTECRISTI MONTECRISTI","1,14,41,122","593 13 09 02",MON,"EC MAN MON MON"
123,03,4,"EL COLORADO",41,"ECUADOR MANABI MONTECRISTI EL COLORADO","1,14,41,123","593 13 09 03",ECO,"EC MAN MON ECO"
124,04,4,"GENERAL ELOY ALFARO",41,"ECUADOR MANABI MONTECRISTI GENERAL ELOY ALFARO","1,14,41,124","593 13 09 04",GEA,"EC MAN MON GEA"
125,05,4,"LEONIDAS PROAÑO",41,"ECUADOR MANABI MONTECRISTI LEONIDAS PROAÑO","1,14,41,125","593 13 09 05",LPR,"EC MAN MON LPR"
127,52,5,"LA PILA",41,"ECUADOR MANABI MONTECRISTI LA PILA","1,14,41,127","593 13 09 52",LPI,"EC MAN MON LPI"
128,50,8,"PAJÁN, CABECERA CANTONAL",42,"ECUADOR MANABI PAJAN PAJAN","1,14,42,128","593 13 10 50",PAJ,"EC MAN PAJ PAJ"
129,51,5,"CAMPOZANO (LA PALMA DE PAJÁN)",42,"ECUADOR MANABI PAJAN CAMPOZANO (LA PALMA)","1,14,42,129","593 13 10 51",CAM,"EC MAN PAJ CAM"
130,52,5,CASCOL,42,"ECUADOR MANABI PAJAN CASCOL","1,14,42,130","593 13 10 52",CAS,"EC MAN PAJ CAS"
131,53,5,GUALE,42,"ECUADOR MANABI PAJAN GUALE","1,14,42,131","593 13 10 53",GUA,"EC MAN PAJ GUA"
132,54,5,LASCANO,42,"ECUADOR MANABI PAJAN LASCANO","1,14,42,132","593 13 10 54",LAS,"EC MAN PAJ LAS"
133,50,8,"PICHINCHA, CABECERA CANTONAL",43,"ECUADOR MANABI PICHINCHA PICHINCHA","1,14,43,133","593 13 11 50",PIC,"EC MAN PIC PIC"
135,52,5,"SAN SEBASTIÁN",43,"ECUADOR MANABI PICHINCHA SAN SEBASTIÁN","1,14,43,135","593 13 11 52",SSE,"EC MAN PIC SSE"
136,50,8,"ROCAFUERTE, CABECERA CANTONAL",44,"ECUADOR MANABI ROCAFUERTE ROCAFUERTE","1,14,44,136","593 13 12 50",ROC,"EC MAN ROC ROC"
137,01,4,"SANTA ANA",45,"ECUADOR MANABI SANTA ANA SANTA ANA","1,14,45,137","593 13 13 01",SAN,"EC MAN SAN SAN"
138,02,4,LODANA,45,"ECUADOR MANABI SANTA ANA LODANA","1,14,45,138","593 13 13 02",LOD,"EC MAN SAN LOD"
139,50,8,"SANTA ANA DE VUELTA, CABECERA CANTONAL",45,"ECUADOR MANABI SANTA ANA SANTA ANA DE VUELTA","1,14,45,139","593 13 13 50",SAN,"EC MAN SAN SAN"
140,51,5,AYACUCHO,45,"ECUADOR MANABI SANTA ANA AYACUCHO","1,14,45,140","593 13 13 51",AYA,"EC MAN SAN AYA"
141,52,5,"HONORATO VÁSQUEZ (CAB. EN VÁSQUEZ)",45,"ECUADOR MANABI SANTA ANA HONORATO VÁSQUEZ (CAB. EN VÁSQUEZ)","1,14,45,141","593 13 13 52",HVA,"EC MAN SAN HVA"
142,53,5,"LA UNIÓN",45,"ECUADOR MANABI SANTA ANA LA UNIÓN","1,14,45,142","593 13 13 53",LUN,"EC MAN SAN LUN"
144,55,5,"SAN PABLO (CAB. EN PUEBLO NUEVO)",45,"ECUADOR MANABI SANTA ANA SAN PABLO (CAB. EN PUEBLO NUEVO)","1,14,45,144","593 13 13 55",SPA,"EC MAN SAN SPA"
145,01,4,"BAHÍA DE CARÁQUEZ ",46,"ECUADOR MANABI SUCRE BAHÍA DE CARÁQUEZ ","1,14,46,145","593 13 14 01",BDC,"EC MAN SUC BDC"
146,02,4,"LEONIDAS PLAZA GUTIÉRREZ",46,"ECUADOR MANABI SUCRE LEONIDAS PLAZA GUTIÉRREZ","1,14,46,146","593 13 14 02",LPG,"EC MAN SUC LPG"
147,50,8,"BAHÍA DE CARÁQUEZ, CABECERA CANTONAL",46,"ECUADOR MANABI SUCRE BAHÍA DE CARÁQUEZ, CABECERA CANTONAL","1,14,46,147","593 13 14 50",BDC,"EC MAN SUC BDC"
150,53,5,CHARAPOTO,46,"ECUADOR MANABI SUCRE CHARAPOTO","1,14,46,150","593 13 14 53",CHA,"EC MAN SUC CHA"
154,57,5,"SAN ISIDRO",46,"ECUADOR MANABI SUCRE SAN ISIDRO","1,14,46,154","593 13 14 57",SIS,"EC MAN SUC SIS"
156,50,8,"TOSAGUA, CABECERA CANTONAL",47,"ECUADOR MANABI TOSAGUA TOSAGUA, CABECERA CANTONAL","1,14,47,156","593 13 15 50",TOS,"EC MAN TOS TOS"
157,51,5,BACHILLERO,47,"ECUADOR MANABI TOSAGUA BACHILLERO","1,14,47,157","593 13 15 51",BAC,"EC MAN TOS BAC"
158,52,5,"ANGEL PEDRO GILER (LA ESTANCILLA)",47,"ECUADOR MANABI TOSAGUA ANGEL PEDRO GILER (LA ESTANCILLA)","1,14,47,158","593 13 15 52",APG,"EC MAN TOS APG"
159,50,8,"SUCRE, CABECERA CANTONAL",48,"ECUADOR MANABI 24 DE MAYO SUCRE, CABECERA CANTONAL","1,14,48,159","593 13 16 50",SUC,"EC MAN 24M SUC"
160,51,5,BELLAVISTA,48,"ECUADOR MANABI 24 DE MAYO BELLAVISTA","1,14,48,160","593 13 16 51",BEL,"EC MAN 24M BEL"
161,52,5,NOBOA,48,"ECUADOR MANABI 24 DE MAYO NOBOA","1,14,48,161","593 13 16 52",NOB,"EC MAN 24M NOB"
162,53,5,"ARQ. SIXTO DURÁN BALLÉN",48,"ECUDAOR MANABI 24 DE MAYO ARQ. SIXTO DURÁN BALLÉN","1,14,48,162","593 13 16 53",SDB,"EC MAN 24M SDB"
163,50,8,"PEDERNALES, CABECERA CANTONAL",49,"ECUADOR MANABI PEDERNALES PEDERNALES, CABECERA CANTONAL","1,14,49,163","593 13 17 50",PED,"EC MAN PED PED"
164,51,5,COJIMÍES,49,"ECUADOR MANABI PEDERNALES COJIMÍES","1,14,49,164","593 13 17 51",COJ,"EC MAN PED COJ"
165,52,5,"DIEZ DE AGOSTO",49,"ECUADOR MANABI PEDERNALES DIEZ DE AGOSTO","1,14,49,165","593 13 17 52",10A,"EC MAN PED 10A"
166,53,5,ATAHUALPA,49,"ECUADOR MANABI PEDERNALES ATAHUALPA","1,14,49,166","593 13 17 53",ATA,"EC MAN PED ATA"
167,50,8,"OLMEDO, CABECERA CANTONAL",50,"ECUADOR MANABI OLMEDO OLMEDO, CABECERA CANTONAL","1,14,50,167","593 13 18 50",OLM,"EC MAN PED OLM"
168,50,8,"PUERTO LÓPEZ, CABECERA CANTONAL",51,"ECUADOR MANABI PUERTO LOPEZ PUERTO LÓPEZ, CABECERA CANTONAL","1,14,51,168","593 13 19 50",PLO,"EC MAN PLO PLO"
169,51,5,MACHALILLA,51,"ECUADOR MANABI PUERTO LOPEZ MACHALILLA","1,14,51,169","593 13 19 51",MAC,"EC MAN PLO MAC"
170,52,5,SALANGO,51,"ECUADOR MANABI PUERTO LOPEZ SALANGO","1,14,51,170","593 13 19 52",SAL,"EC MAN PLO SAL"
171,50,8,"JAMA, CABECERA CANTONAL",52,"ECUADOR MANABI JAMA JAMA, CABECERA CANTONAL","1,14,52,171","593 13 20 50",JAM,"EC MAN JAM JAM"
172,50,8,JARAMIJO,53,"ECUADOR MANABI JARAMIJO JARAMIJO","1,14,53,172","593 13 21 50",JAR,"EC MAN JAR JAR"
173,50,8,"SAN VICENTE, CABECERA CANTONAL",54,"ECUADOR MANABI SAN VICENTE SAN VICENTE, CABECERA CANTONAL","1,14,54,173","593 13 22 50",SVI,"EC MAN SVI SVI"
174,51,5,CANOA,54,"ECUADOR MANABI SAN VICENTE CANOA","1,14,54,174","593 13 22 51",CAN,"EC MAN SVI CAN"
175,50,8,"PORTOVIEJO, CABECERA CANTONAL ",33,"ECUADOR MANABI PORTOVIEJO PORTOVIEJO, CABECERA CANTONAL","1,14,33,175","593 13 01 50",POR,"EC MAN POR POR"
176,50,8,"CHONE , CABECERA CANTONAL",35,"ECUADOR MANABI CHONE, CABECERA CANTONAL","1,14,35,176","593 13 03 50",CHO,"EC MAN POR CHO"
177,50,8,"EL CARMEN , CABECERA CANTONAL",36,"ECUADOR MANABI EL CARMEN EL CARMEN, CABECERA CANTONAL","1,14,36,177","593 13 04 50",ECA,"EC MAN ECA ECA"
178,50,8,"FLAVIO ALFARO, CABECERA CANTONAL",37,"ECUADOR MANABI FLAVIO ALFARO, CABECERA CANTONAL","1,14,37,178","593 13 05 50",FAL,"EC MAN FAL FAL"
179,50,8,JIPIJAPA,38,"ECUADOR MANABI JIPIJAPA","1,14,38,179","593 13 06 50",JIP,"EC MAN JIP JIP"
180,50,8,"MANTA, CABECERA CANTONAL",40,"ECUADOR MANABI MANTA, CABECERA CANTONAL","1,14,40,180","593 13 08 50",MAN,"EC MAN MAN MAN"
181,50,8,"MONTECRISTI, CABECERA CANTONAL",41,"ECUADOR MANABI MONTECRISTI, CABECERA CANTONAL","1,14,41,181","593 13 09 50",MON,"EC MAN MON MON"
200,01,3,CUENCA,2,"ECUADOR AZUAY CUENCA","1,2,200","593 01 01",CUE,"EC AZU CUE"
201,02,3,GIRÓN,2,"ECUADOR AZUAY GIRÓN","1,2,201","593 01 02",GIR,"EC AZU GIR"
202,03,3,GUALACEO,2,"ECUADOR AZUAY GUALACEO","1,2,202","593 01 03",GUA,"EC AZU GUA"
203,04,3,NABÓN,2,"ECUADOR AZUAY NABÓN","1,2,203","593 01 04",NAB,"EC AZU NAB"
204,05,3,PAUTE,2,"ECUADOR AZUAY PAUTE","1,2,204","593 01 05",PAU,"EC AZU PAU"
205,06,3,PUCARÁ,2,"ECUADOR AZUAY PUCARÁ","1,2,205","593 01 06",PUC,"EC AZU PUC"
206,07,3,"SAN FERNANDO",2,"ECUADOR AZUAY SAN FERNANDO","1,2,206","593 01 07",SFE,"EC AZU SFE"
207,08,3,"SANTA ISABEL",2,"ECUADOR AZUAY SANTA ISABEL","1,2,207","593 01 08",SIS,"EC AZU SIS"
208,09,3,SIGSIG,2,"ECUADOR AZUAY SIGSIG","1,2,208","593 01 09",SIG,"EC AZU SIG"
209,10,3,OÑA,2,"ECUADOR AZUAY OÑA","1,2,209","593 01 10",OÑA,"EC AZU OÑA"
210,11,3,CHORDELEG,2,"ECUADOR AZUAY CHORDELEG","1,2,210","593 01 11",CHO,"EC AZU CHO"
211,12,3,"EL PAN",2,"ECUADOR AZUAY EL PAN","1,2,211","593 01 12",EPA,"EC AZU EPA"
212,13,3,"SEVILLA DE ORO",2,"ECUADOR AZUAY SEVILLA DE ORO","1,2,212","593 01 13",SDO,"EC AZU SDO"
213,14,3,GUACHAPALA,2,"ECUADOR AZUAY GUACHAPALA","1,2,213","593 01 14",GUA,"EC AZU GUA"
214,15,3,"CAMILO PONCE ENRÍQUEZ",2,"ECUADOR AZUAY CAMILO PONCE ENRÍQUEZ","1,2,214","593 01 15",CPE,"EC AZU CPE"
250,01,3,GUARANDA,3,"ECUADOR BOLIVAR GUARANDA","1,3,250","593 02 01",GUA,"EC BOL GUA"
251,02,3,CHILLANES,3,"ECUADOR BOLIVAR CHILLANES","1,3,251","593 02 02",CLL,"EC BOL CLL"
252,03,3,CHIMBO,3,"ECUADOR BOLIVAR CHIMBO","1,3,252","593 02 03",CMB,"EC BOL CMB"
253,04,3,ECHEANDÍA,3,"ECUADOR BOLIVAR ECHEANDÍA","1,3,253","593 02 04",ECH,"EC BOL ECH"
254,05,3,"SAN MIGUEL",3,"ECUADOR BOLIVAR SAN MIGUEL","1,3,254","593 02 05",SMI,"EC BOL SMI"
255,06,3,CALUMA,3,"ECUADOR BOLIVAR CALUMA","1,3,255","593 02 06",CAL,"EC BOL CAL"
256,07,3,"LAS NAVES",3,"ECUADOR BOLIVAR LAS NAVES","1,3,256","593 02 07",LNA,"EC BOL LNA"
300,01,3,AZOGUES,4,"ECUADOR CAÑAR AZOGUES","1,4,300","593 03 01",AZO,"EC CAÑ AZO"
301,02,3,BIBLIÁN,4,"ECUADOR CAÑAR BIBLIÁN","1,4,301","593 03 02",BIB,"EC CAÑ BIB"
302,03,3,CAÑAR,4,"ECUADOR CAÑAR CAÑAR","1,4,302","593 03 03",CAÑ,"EC CAÑ CAÑ"
303,04,3,"LA TRONCAL",4,"ECUADOR CAÑAR LA TRONCAL","1,4,303","593 03 04",LTR,"EC CAÑ LTR"
304,05,3,"EL TAMBO",4,"ECUADOR CAÑAR EL TAMBO","1,4,304","593 03 05",ETA,"EC CAÑ ETA"
305,06,3,DÉELEG,4,"ECUADOR CAÑAR DÉELEG","1,4,305","593 03 06",DEE,"EC CAÑ DEE"
306,07,3,SUSCAL,4,"ECUADOR CAÑAR SUSCAL","1,4,306","593 03 07",SUS,"EC CAÑ SUS"
350,01,3,RIOBAMBA,7,"ECUADOR CHIMBORAZO RIOBAMBA","1,7,350","593 06 01",RIO,"EC CHI RIO"
351,02,3,ALAUSÍ,7,"ECUADOR CHIMBORAZO ALAUSÍ","1,7,351","593 06 02",ALA,"EC CHI ALA"
352,03,3,COLTA,7,"ECUADOR CHIMBORAZO COLTA","1,7,352","593 06 03",COL,"EC CHI COL"
353,04,3,CHAMBO,7,"ECUADOR CHIMBORAZO CHAMBO","1,7,353","593 06 04",CHA,"EC CHI CHA"
354,05,3,CHUNCHI,7,"ECUADOR CHIMBORAZO CHUNCHI","1,7,354","593 06 05",CHU,"EC CHI CHU"
355,06,3,GUAMOTE,7,"ECUADOR CHIMBORAZO GUAMOTE","1,7,355","593 06 06",GUA,"EC CHI GUA"
356,07,3,GUANO,7,"ECUADOR CHIMBORAZO GUANO","1,7,356","593 06 07",GUA,"EC CHI GUA"
357,08,3,PALLATANGA,7,"ECUADOR CHIMBORAZO PALLATANGA","1,7,357","593 06 08",PAL,"EC CHI PAL"
358,09,3,PENIPE,7,"ECUADOR CHIMBORAZO PENIPE","1,7,358","593 06 09",PEN,"EC CHI PEN"
359,10,3,CUMANDÁ,7,"ECUADOR CHIMBORAZO CUMANDÁ","1,7,359","593 06 10",CUM,"EC CHI CUM"
400,01,3,MACHALA,8,"ECUADOR EL ORO MACHALA","1,8,400","593 07 01",MAC,"EC EOR MAC"
401,02,3,ARENILLAS,8,"ECUADOR EL ORO ARENILLAS","1,8,401","593 07 02",ARE,"EC EOR ARE"
402,03,3,ATAHUALPA,8,"ECUADOR EL ORO ATAHUALPA","1,8,402","593 07 03",ATA,"EC EOR ATA"
403,04,3,BALSAS,8,"ECUADOR EL ORO BALSAS","1,8,403","593 07 04",BAL,"EC EOR BAL"
404,05,3,CHILLA,8,"ECUADOR EL ORO CHILLA","1,8,404","593 07 05",CHI,"EC EOR CHI"
405,06,3,"EL GUABO",8,"ECUADOR EL ORO EL GUABO","1,8,405","593 07 06",EGU,"EC EOR EGU"
406,07,3,HUAQUILLAS,8,"ECUADOR EL ORO HUAQUILLAS","1,8,406","593 07 07",HUA,"EC EOR HUA"
407,08,3,MARCABELÍ,8,"ECUADOR EL ORO MARCABELÍ","1,8,407","593 07 08",MAR,"EC EOR MAR"
408,09,3,PASAJE,8,"ECUADOR EL ORO PASAJE","1,8,408","593 07 09",PAS,"EC EOR PAS"
409,10,3,PIÑAS,8,"ECUADOR EL ORO PIÑAS","1,8,409","593 07 10",PIÑ,"EC EOR PIÑ"
410,11,3,PORTOVELO,8,"ECUADOR EL ORO PORTOVELO","1,8,410","593 07 11",POR,"EC EOR POR"
411,12,3,"SANTA ROSA",8,"ECUADOR EL ORO SANTA ROSA","1,8,411","593 07 12",SRO,"EC EOR SRO"
412,13,3,ZARUMA,8,"ECUADOR EL ORO ZARUMA","1,8,412","593 07 13",ZAR,"EC EOR ZAR"
413,14,3,"LAS LAJAS",8,"ECUADOR EL ORO LAS LAJAS","1,8,413","593 07 14",LLA,"EC EOR LLA"
451,02,3,"ALFREDO BAQUERIZO MORENO (JUJÁN)",10,"ECUADOR GUAYAS ALFREDO BAQUERIZO MORENO (JUJÁN)","1,10,451","593 09 02",ABM,"EC GUA ABM"
452,03,3,BALAO,10,"ECUADOR GUAYAS BALAO","1,10,452","593 09 03",BAO,"EC GUA BAO"
453,04,3,BALZAR,10,"ECUADOR GUAYAS BALZAR","1,10,453","593 09 04",BAZ,"EC GUA BAZ"
454,05,3,COLIMES,10,"ECUADOR GUAYAS COLIMES","1,10,454","593 09 05",COL,"EC GUA COL"
455,06,3,DAULE,10,"ECUADOR GUAYAS DAULE","1,10,455","593 09 06",DAU,"EC GUA DAU"
456,07,3,DURÁN,10,"ECUADOR GUAYAS DURÁN","1,10,456","593 09 07",DUR,"EC GUA DUR"
457,08,3,"EL EMPALME",10,"ECUADOR GUAYAS EL EMPALME","1,10,457","593 09 08",EEM,"EC GUA EEM"
458,09,3,"EL TRIUNFO",10,"ECUADOR GUAYAS EL TRIUNFO","1,10,458","593 09 09",ETR,"EC GUA ETR"
459,10,3,MILAGRO,10,"ECUADOR GUAYAS MILAGRO","1,10,459","593 09 10",MIL,"EC GUA MIL"
460,11,3,NARANJAL,10,"ECUADOR GUAYAS NARANJAL","1,10,460","593 09 11",NAL,"EC GUA NAL"
461,12,3,NARANJITO,10,"ECUADOR GUAYAS NARANJITO","1,10,461","593 09 12",NAO,"EC GUA NAO"
462,13,3,PALESTINA,10,"ECUADOR GUAYAS PALESTINA","1,10,462","593 09 13",PAL,"EC GUA PAL"
463,14,3,"PEDRO CARBO",10,"ECUADOR GUAYAS PEDRO CARBO","1,10,463","593 09 14",PCA,"EC GUA PCA"
465,16,3,SAMBORONDÓN,10,"ECUADOR GUAYAS SAMBORONDÓN","1,10,465","593 09 16",SAM,"EC GUA SAM"
467,18,3,"SANTA LUCÍA",10,"ECUADOR GUAYAS SANTA LUCÍA","1,10,467","593 09 18",SLU,"EC GUA SLU"
468,19,3,"SALITRE (URBINA JADO)",10,"ECUADOR GUAYAS SALITRE (URBINA JADO)","1,10,468","593 09 19",SAL,"EC GUA SAL"
469,20,3,"SAN JACINTO DE YAGUACHI",10,"ECUADOR GUAYAS SAN JACINTO DE YAGUACHI","1,10,469","593 09 20",SJA,"EC GUA SJA"
470,21,3,PLAYAS,10,"ECUADOR GUAYAS PLAYAS","1,10,470","593 09 21",PLA,"EC GUA PLA"
471,22,3,"SIMÓN BOLÍVAR",10,"ECUADOR GUAYAS SIMÓN BOLÍVAR","1,10,471","593 09 22",SBO,"EC GUA SBO"
472,23,3,"CORONEL MARCELINO MARIDUEÑA",10,"ECUADOR GUAYAS CORONEL MARCELINO MARIDUEÑA","1,10,472","593 09 23",CMM,"EC GUA CMM"
473,24,3,"LOMAS DE SARGENTILLO",10,"ECUADOR GUAYAS LOMAS DE SARGENTILLO","1,10,473","593 09 24",LSA,"EC GUA LSA"
474,25,3,NOBOL,10,"ECUADOR GUAYAS NOBOL","1,10,474","593 09 25",NOB,"EC GUA NOB"
476,27,3,"GENERAL ANTONIO ELIZALDE (BUCAY)",10,"ECUADOR GUAYAS GENERAL ANTONIO ELIZALDE (BUCAY)","1,10,476","593 09 27",GAE,"EC GUA GAE"
477,28,3,"ISIDRO AYORA",10,"ECUADOR GUAYAS ISIDRO AYORA","1,10,477","593 09 28",IAY,"EC GUA IAY"
500,01,3,BABAHOYO,13,"ECUADOR LOS RIOS BABAHOYO","1,13,500","593 12 01",BAH,"EC LRI BAH"
501,02,3,BABA,13,"ECUADOR LOS RIOS BABA","1,13,501","593 12 02",BAB,"EC LRI BAB"
502,03,3,MONTALVO,13,"ECUADOR LOS RIOS MONTALVO","1,13,502","593 12 03",MON,"EC LRI MON"
503,04,3,PUEBLOVIEJO,13,"ECUADOR LOS RIOS PUEBLOVIEJO","1,13,503","593 12 04",PUE,"EC LRI PUE"
504,05,3,QUEVEDO,13,"ECUADOR LOS RIOS QUEVEDO","1,13,504","593 12 05",QUE,"EC LRI QUE"
505,06,3,"URDANETA (CATARAMA) ",13,"ECUADOR LOS RIOS URDANETA (CATARAMA) ","1,13,505","593 12 06",URD,"EC LRI URD"
506,07,3,VENTANAS,13,"ECUADOR LOS RIOS VENTANAS","1,13,506","593 12 07",VEN,"EC LRI VEN"
507,08,3,VINCES,13,"ECUADOR LOS RIOS VINCES","1,13,507","593 12 08",VIN,"EC LRI VIN"
508,09,3,PALENQUE,13,"ECUADOR LOS RIOS PALENQUE","1,13,508","593 12 09",PAL,"EC LRI PAL"
509,10,3,"BUENA FÉ",13,"ECUADOR LOS RIOS BUENA FÉ","1,13,509","593 12 10",BUE,"EC LRI BUE"
510,11,3,VALENCIA,13,"ECUADOR LOS RIOS VALENCIA","1,13,510","593 12 11",VAL,"EC LRI VAL"
511,12,3,MOCACHE,13,"ECUADOR LOS RIOS MOCACHE","1,13,511","593 12 12",MOC,"EC LRI MOC"
512,13,3,QUINSALOMA,13,"ECUADOR LOS RIOS QUINSALOMA","1,13,512","593 12 13",QUI,"EC LRI QUI"
1000,50,8,"CUENCA, CABECERA CANTONAL Y CAPITAL PROVINCIAL.",200,"ECUADOR AZUAY CUENCA CUENCA, CABECERA CANTONAL Y CAPITAL PROVINCIAL.","1,2,200,1000","593 01 01 50",CUE,"EC AZU CUE CUE"
1001,01,4,BELLAVISTA,200,"ECUADOR AZUAY CUENCA BELLAVISTA","1,2,200,1001","593 01 01 01",BEL,"EC AZU CUE BEL"
1002,02,4,CAÑARIBAMBA,200,"ECUADOR AZUAY CUENCA CAÑARIBAMBA","1,2,200,1002","593 01 01 02",CAÑ,"EC AZU CUE CAÑ"
1003,03,4,"EL BATÁN",200,"ECUADOR AZUAY CUENCA EL BATÁN","1,2,200,1003","593 01 01 03",ELB,"EC AZU CUE ELB"
1004,04,4,"EL SAGRARIO",200,"ECUADOR AZUAY CUENCA EL SAGRARIO","1,2,200,1004","593 01 01 04",ELS,"EC AZU CUE ELS"
1005,05,4,"EL VECINO",200,"ECUADOR AZUAY CUENCA EL VECINO","1,2,200,1005","593 01 01 05",ELV,"EC AZU CUE ELV"
1006,06,4,"GIL RAMÍREZ DÁVALOS",200,"ECUADOR AZUAY CUENCA GIL RAMÍREZ DÁVALOS","1,2,200,1006","593 01 01 06",GIL,"EC AZU CUE GIL"
1007,07,4,HUAYNACÁPAC,200,"ECUADOR AZUAY CUENCA HUAYNACÁPAC","1,2,200,1007","593 01 01 07",HUA,"EC AZU CUE HUA"
1008,08,4,MACHÁNGARA,200,"ECUADOR AZUAY CUENCA MACHÁNGARA","1,2,200,1008","593 01 01 08",MAC,"EC AZU CUE MAC"
1009,09,4,MONAY,200,"ECUADOR AZUAY CUENCA MONAY","1,2,200,1009","593 01 01 09",MON,"EC AZU CUE MON"
1010,10,4,"SAN BLAS",200,"ECUADOR AZUAY CUENCA SAN BLAS","1,2,200,1010","593 01 01 10",SAN,"EC AZU CUE SAN"
1011,11,4,"SAN SEBASTIÁN",200,"ECUADOR AZUAY CUENCA SAN SEBASTIÁN","1,2,200,1011","593 01 01 11",SAN,"EC AZU CUE SAN"
1012,12,4,SUCRE,200,"ECUADOR AZUAY CUENCA SUCRE","1,2,200,1012","593 01 01 12",SUC,"EC AZU CUE SUC"
