ID_TERRITORIO,CODIGO,ID_NIVEL_TERRITORIAL,DESCRIPCION,ID_TERRITORIO_PADRE,PATH_DESCRIPCION,PATH_ID,PATH_CODIGO,NOMECLATURA,PATH_NOMECLATURA
3395,51,5,"GONZALO DíAZ DE PINEDA (EL BOMBÓN) ",3375,"ECUADOR NAPO EL CHACO GONZALO DíAZ DE PINEDA (EL BOMBÓN) ","1,16,3375,3395","593 15 04 51",NULL,NULL
3396,50,8,"BAEZA, CABECERA CANTONAL",3376,"ECUADOR NAPO QUIJOS BAEZA, CABECERA CANTONAL","1,16,3376,3396","593 15 07 50",NULL,NULL
3397,51,5,COSANGA,3376,"ECUADOR NAPO QUIJOS COSANGA","1,16,3376,3397","593 15 07 51",NULL,NULL
3398,52,5,CUYUJA,3376,"ECUADOR NAPO QUIJOS CUYUJA","1,16,3376,3398","593 15 07 52",NULL,NULL
3399,53,5,PAPALLACTA,3376,"ECUADOR NAPO QUIJOS PAPALLACTA","1,16,3376,3399","593 15 07 53",NULL,NULL
3400,54,5,"SAN FRANCISCO DE BORJA (VIRGILIO DÁVILA)",3376,"ECUADOR NAPO QUIJOS SAN FRANCISCO DE BORJA (VIRGILIO DÁVILA)","1,16,3376,3400","593 15 07 54",NULL,NULL
3401,56,5,SUMACO,3376,"ECUADOR NAPO QUIJOS SUMACO","1,16,3376,3401","593 15 07 56",NULL,NULL
3402,50,8,"CARLOS JULIO AROSEMENA TOLA, CABECERA CANTONAL			",3377,"ECUADOR NAPO CARLOS JULIO AROSEMENA TOLA CARLOS JULIO AROSEMENA TOLA, CABECERA CANTONAL		","1,16,3377,3402","593 15 09 50",NULL,NULL
3403,01,3,PASTAZA,17,"ECUADOR PASTAZA PASTAZA","1,17,4303","593 16 01 ",NULL,NULL
3404,02,3,MERA,17,"ECUADOR PASTAZA MERA","1,17,4304","593 16 02",NULL,NULL
3405,03,3,"SANTA CLARA",17,"ECUADOR PASTAZA SANTA CLARA","1,17,4305","593 16 03 ",NULL,NULL
3406,04,3,ARAJUNO,17,"ECUADOR PASTAZA ARAJUNO","1,17,4306","593 16 04 ",NULL,NULL
3407,50,8,"PUYO, CABECERA CANTONAL Y CAPITAL PROVINCIAL		",3403,"ECUADOR PASTAZA PASTAZA PUYO, CABECERA CANTONAL Y CAPITAL PROVINCIAL		","1,17,3403,3407","593 16 01 50",NULL,NULL
3408,52,5,CANELOS,3403,"ECUADOR PASTAZA PASTAZA CANELOS","1,17,3403,3408","593 16 01 52",NULL,NULL
3409,56,5,"MONTALVO (ANDOAS) ",3403,"ECUADOR PASTAZA PASTAZA MONTALVO (ANDOAS) ","1,17,3403,3409","593 16 01 56",NULL,NULL
3410,54,5,"DIEZ  DE AGOSTO",3403,"ECUADOR PASTAZA PASTAZA DIEZ  DE AGOSTO","1,17,3403,3410","593 16 01 54",NULL,NULL
3411,55,5,FÁTIMA,3403,"ECUADOR PASTAZA PASTAZA FÁTIMA","1,17,3403,3411","593 16 01 55",NULL,NULL
3412,57,5,POMONA,3403,"ECUADOR PASTAZA PASTAZA POMONA","1,17,3403,3412","593 16 01 57",NULL,NULL
3413,59,5,"RÍO TIGRE",3403,"ECUADOR PASTAZA PASTAZA RÍO TIGRE","1,17,3403,3413","593 16 01 59",NULL,NULL
3414,63,5,TARQUI,3403,"ECUADOR PASTAZA PASTAZA TARQUI","1,17,3403,3414","593 16 01 63",NULL,NULL
3415,58,5,"RÍO CORRIENTES ",3403,"ECUADOR PASTAZA PASTAZA RÍO CORRIENTES ","1,17,3403,3415","593 16 01 58",NULL,NULL
3416,61,5,SARAYACU,3403,"ECUADOR PASTAZA PASTAZA SARAYACU","1,17,3403,3416","593 16 01 61",NULL,NULL
3417,62,5,"SIMÓN BOLÍVAR  (CAB. EN MUSHULLACTA)",3403,"ECUADOR PASTAZA PASTAZA SIMÓN BOLÍVAR  (CAB. EN MUSHULLACTA)","1,17,3403,3417","593 16 01 62",NULL,NULL
3418,64,5,"TENIENTE HUGO ORTIZ",3403,"ECUADOR PASTAZA PASTAZA TENIENTE HUGO ORTIZ","1,17,3403,3418","593 16 01 64",NULL,NULL
3419,66,5,"EL TRIUNFO",3403,"ECUADOR PASTAZA PASTAZA EL TRIUNFO","1,17,3403,3419","593 16 01 66",NULL,NULL
3420,65,5,"VERACRUZ  (CAB. EN INDILLAMA)",3403,"ECUADOR PASTAZA PASTAZA VERACRUZ  (CAB. EN INDILLAMA)","1,17,3403,3420","593 16 01 65",NULL,NULL
3421,50,8,"MERA, CABECERA CANTONAL",3404,"ECUADOR PASTAZA MERA MERA, CABECERA CANTONAL","1,17,3404,3421","593 16 02 50",NULL,NULL
3422,52,5,SHELL,3404,"ECUADOR PASTAZA MERA SHELL","1,17,3404,3422","593 16 02 52",NULL,NULL
3423,51,5,"MADRE TIERRA",3404,"ECUADOR PASTAZA MERA MADRE TIERRA","1,17,3404,3423","593 16 02 51",NULL,NULL
3424,51,5,"SAN JOSÉ",3405,"ECUADOR PASTAZA SANTA CLARA SAN JOSÉ","1,17,3405,3424","593 16 03 51",NULL,NULL
3425,50,8,"SANTA CLARA, CABECERA CANTONAL",3405,"ECUADOR PASTAZA SANTA CLARA SANTA CLARA, CABECERA CANTONAL","1,17,3405,3425","593 16 03 50",NULL,NULL
3426,50,8,"ARAJUNO, CABECERA CANTONAL",3406,"ECUADOR PASTAZA ARAJUNO ARAJUNO, CABECERA CANTONAL","1,17,3406,3426","593 16 04 50",NULL,NULL
3427,51,5,CURARAY,3406,"ECUADOR PASTAZA ARAJUNO CURARAY","1,17,3406,3427","593 16 04 51",NULL,NULL
3428,01,3,AMBATO,19,"ECUADOR TUNGURAHUA AMBATO","1,19,3428","593 18 01",NULL,NULL
3429,02,3,"BAÑOS DE AGUA SANTA",19,"ECUADOR TUNGURAHUA BAÑOS DE AGUA SANTA","1,19,3429","593 18 02",NULL,NULL
3430,03,3,CEVALLOS,19,"ECUADOR TUNGURAHUA CEVALLOS","1,19,3430","593 18 03",NULL,NULL
3431,04,3,MOCHA,19,"ECUADOR TUNGURAHUA MOCHA","1,19,3431","593 18 04",NULL,NULL
3432,05,3,PATATE,19,"ECUADOR TUNGURAHUA PATATE","1,19,3432","593 18 05",NULL,NULL
3433,06,3,QUERO,19,"ECUADOR TUNGURAHUA QUERO","1,19,3433","593 18 06",NULL,NULL
3434,07,3,"SAN PEDRO DE PELILEO",19,"ECUADOR TUNGURAHUA SAN PEDRO DE PELILEO","1,19,3434","593 18 07",NULL,NULL
3435,08,3,"SANTIAGO DE PÍLLARO",19,"ECUADOR TUNGURAHUA SANTIAGO DE PÍLLARO","1,19,3435","593 18 08",NULL,NULL
3436,09,3,TISALEO,19,"ECUADOR TUNGURAHUA TISALEO","1,19,3436","593 18 09",NULL,NULL
3437,50,4,"AMBATO, CABECERA CANTONAL Y CAPITAL PROVINCIAL",3428,"ECUADOR TUNGURAHUA AMBATO AMBATO, CABECERA CANTONAL Y CAPITAL PROVINCIAL				","1,19,3428 3437","593 18 01 50",NULL,NULL
3438,09,4,"SAN FRANCISCO",3428,"ECUADOR TUNGURAHUA AMBATO SAN FRANCISCO","1,19,3428 3438","593 18 01 09",NULL,NULL
3439,06,4,"LA PENÍNSULA",3428,"ECUADOR TUNGURAHUA AMBATO LA PENÍNSULA","1,19,3428 3439","593 18 01 06",NULL,NULL
3440,07,4,MATRIZ,3428,"ECUADOR TUNGURAHUA AMBATO MATRIZ","1,19,3428 3440","593 18 01 07",NULL,NULL
3441,05,4,"LA MERCED",3428,"ECUADOR TUNGURAHUA AMBATO LA MERCED","1,19,3428 3441","593 18 01 05",NULL,NULL
3442,04,4,"HUACHI LORETO",3428,"ECUADOR TUNGURAHUA AMBATO HUACHI LORETO","1,19,3428 3442","593 18 01 54",NULL,NULL
3443,03,4,"HUACHI CHICO",3428,"ECUADOR TUNGURAHUA AMBATO HUACHI CHICO","1,19,3428 3443","593 18 01 53",NULL,NULL
3444,01,4,"ATOCHA – FICOA",3428,"ECUADOR TUNGURAHUA AMBATO ATOCHA – FICOA","1,19,3428 3444","593 18 01 51",NULL,NULL
3445,02,4,"CELIANO MONGE",3428,"ECUADOR TUNGURAHUA AMBATO CELIANO MONGE","1,19,3428 3445","593 18 01 52",NULL,NULL
3446,08,4,PISHILATA,3428,"ECUADOR TUNGURAHUA AMBATO PISHILATA","1,19,3428 3446","593 18 01 08",NULL,NULL
3447,51,5,AMBATILLO,3428,"ECUADOR TUNGURAHUA AMBATO AMBATILLO","1,19,3428 3447","593 18 01 51",NULL,NULL
3448,52,5,"ATAHUALPA (CHISALATA) ",3428,"ECUADOR TUNGURAHUA AMBATO ATAHUALPA (CHISALATA) ","1,19,3428 3448","593 18 01 52",NULL,NULL
3449,55,5,"HUACHI GRANDE",3428,"ECUADOR TUNGURAHUA AMBATO HUACHI GRANDE","1,19,3428 3449","593 18 01 55",NULL,NULL
3450,57,5,"JUAN BENIGNO VELA",3428,"ECUADOR TUNGURAHUA AMBATO JUAN BENIGNO VELA","1,19,3428 3450","593 18 01 57",NULL,NULL
3451,53,5,"AUGUSTO N. MARTÍNEZ (MUNDUGLEO)",3428,"ECUADOR TUNGURAHUA AMBATO AUGUSTO N. MARTÍNEZ (MUNDUGLEO)","1,19,3428 3451","593 18 01 53",NULL,NULL
3452,58,5,MONTALVO,3428,"ECUADOR TUNGURAHUA AMBATO MONTALVO","1,19,3428 3452","593 18 01 58",NULL,NULL
3453,54,5,"CONSTANTINO FERNÁNDEZ (CAB. EN CULLITAHUA)",3428,"ECUADOR TUNGURAHUA AMBATO CONSTANTINO FERNÁNDEZ (CAB. EN CULLITAHUA)","1,19,3428 3453","593 18 01 54",NULL,NULL
3454,56,5,IZAMBA,3428,"ECUADOR TUNGURAHUA AMBATO IZAMBA","1,19,3428 3454","593 18 01 56",NULL,NULL
3455,60,5,PICAIGUA,3428,"ECUADOR TUNGURAHUA AMBATO PICAIGUA","1,19,3428 3455","593 18 01 60",NULL,NULL
3456,59,5,PASA,3428,"ECUADOR TUNGURAHUA AMBATO PASA","1,19,3428 3456","593 18 01 59",NULL,NULL
3457,61,5,"PILAGÜÍN (PILAHÜÍN)",3428,"ECUADOR TUNGURAHUA AMBATO PILAGÜÍN (PILAHÜÍN)","1,19,3428 3457","593 18 01 61",NULL,NULL
3458,62,5,"QUISAPINCHA (QUIZAPINCHA)",3428,"ECUADOR TUNGURAHUA AMBATO QUISAPINCHA (QUIZAPINCHA)","1,19,3428 3458","593 18 01 62",NULL,NULL
3459,63,5,"SAN BARTOLOMÉ DE PINLLOG",3428,"ECUADOR TUNGURAHUA AMBATO SAN BARTOLOMÉ DE PINLLOG","1,19,3428 3459","593 18 01 63",NULL,NULL
3460,65,5,"SANTA ROSA",3428,"ECUADOR TUNGURAHUA AMBATO SANTA ROSA","1,19,3428 3460","593 18 01 65",NULL,NULL
3461,66,5,TOTORAS,3428,"ECUADOR TUNGURAHUA AMBATO TOTORAS","1,19,3428 3461","593 18 01 66",NULL,NULL
3462,64,5,"SAN FERNANDO (PASA SAN FERNANDO)",3428,"ECUADOR TUNGURAHUA AMBATO SAN FERNANDO (PASA SAN FERNANDO)","1,19,3428 3462","593 18 01 64",NULL,NULL
3463,67,5,CUNCHIBAMBA,3428,"ECUADOR TUNGURAHUA AMBATO CUNCHIBAMBA","1,19,3428 3463","593 18 01 67",NULL,NULL
3464,68,5,UNAMUNCHO,3428,"ECUADOR TUNGURAHUA AMBATO UNAMUNCHO","1,19,3428 3464","593 18 01 68",NULL,NULL
3465,50,8,"BAÑOS DE AGUA SANTA, CABECERA CANTONAL			",3429,"ECUADOR TUNGURAHUA BAÑOS DE AGUA SANTA BAÑOS DE AGUA SANTA, CABECERA CANTONAL			","1,19,3429 3465","593 18 02 50",NULL,NULL
3466,51,5,LLIGUA,3429,"ECUADOR TUNGURAHUA BAÑOS DE AGUA SANTA LLIGUA","1,19,3429 3466","593 18 02 51",NULL,NULL
3467,53,5,"RÍO VERDE",3429,"ECUADOR TUNGURAHUA BAÑOS DE AGUA SANTA RÍO VERDE","1,19,3429 3467","593 18 02 53",NULL,NULL
3468,52,5,"RÍO NEGRO",3429,"ECUADOR TUNGURAHUA BAÑOS DE AGUA SANTA RÍO NEGRO","1,19,3429 3468","593 18 02 52",NULL,NULL
3469,54,5,ULBA,3429,"ECUADOR TUNGURAHUA BAÑOS DE AGUA SANTA ULBA","1,19,3429 3469","593 18 02 54",NULL,NULL
3470,50,8,"CEVALLOS, CABECERA CANTONAL",3430,"ECUADOR TUNGURAHUA CEVALLOS CEVALLOS, CABECERA CANTONAL","1,19,3430 3470","593 18 03 50",NULL,NULL
3471,51,5,PINGUILÍ,3431,"ECUADOR TUNGURAHUA MOCHA PINGUILÍ","1,19,3431 3471","593 18 04 51",NULL,NULL
3472,50,8,"MOCHA, CABECERA CANTONAL",3431,"ECUADOR TUNGURAHUA MOCHA MOCHA, CABECERA CANTONAL","1,19,3431 3472","593 18 04 50",NULL,NULL
3473,50,8,"PATATE, CABECERA CANTONAL",3432,"ECUADOR TUNGURAHUA PATATE PATATE, CABECERA CANTONAL","1,19,3432 3473","593 18 05 50",NULL,NULL
3474,51,5,"EL TRIUNFO",3432,"ECUADOR TUNGURAHUA PATATE EL TRIUNFO","1,19,3432 3474","593 18 05 51",NULL,NULL
3475,52,5,"LOS ANDES (CAB. EN POATUG) ",3432,"ECUADOR TUNGURAHUA PATATE LOS ANDES (CAB. EN POATUG) ","1,19,3432 3475","593 18 05 52",NULL,NULL
3476,53,5,"SUCRE (CAB. EN SUCRE-PATATE URCU)",3432,"ECUADOR TUNGURAHUA PATATE SUCRE (CAB. EN SUCRE-PATATE URCU)","1,19,3432 3476","593 18 05 53",NULL,NULL
3477,50,8,"QUERO, CABECERA CANTONAL",3433,"ECUADOR TUNGURAHUA QUERO QUERO, CABECERA CANTONAL","1,19,3433 3477","593 18 06 50",NULL,NULL
3478,52,5,"YANAYACU - MOCHAPATA (CAB. EN YANAYACU) ",3433,"ECUADOR TUNGURAHUA QUERO YANAYACU - MOCHAPATA (CAB. EN YANAYACU) ","1,19,3433 3478","593 18 06 52",NULL,NULL
3479,51,5,RUMIPAMBA,3433,"ECUADOR TUNGURAHUA QUERO RUMIPAMBA","1,19,3433 3479","593 18 06 51",NULL,NULL
3480,50,8,"PELILEO, CABECERA CANTONAL",3434,"ECUADOR TUNGURAHUA SAN PEDRO DE PELILEO PELILEO, CABECERA CANTONAL","1,19,3434 3480","593 18 07 50",NULL,NULL
3481,52,5,BOLÍVAR,3434,"ECUADOR TUNGURAHUA SAN PEDRO DE PELILEO BOLÍVAR","1,19,3434 3481","593 18 07 52",NULL,NULL
3482,02,4,"PELILEO GRANDE",3434,"ECUADOR TUNGURAHUA SAN PEDRO DE PELILEO PELILEO GRANDE","1,19,3434 3482","593 18 07 02",NULL,NULL
3483,51,5,"BENÍTEZ (PACHANLICA) ",3434,"ECUADOR TUNGURAHUA SAN PEDRO DE PELILEO BENÍTEZ (PACHANLICA) ","1,19,3434 3483","593 18 07 51",NULL,NULL
3484,53,5,COTALÓ,3434,"ECUADOR TUNGURAHUA SAN PEDRO DE PELILEO COTALÓ","1,19,3434 3484","593 18 07 53",NULL,NULL
3485,01,4,PELILEO,3434,"ECUADOR TUNGURAHUA SAN PEDRO DE PELILEO PELILEO","1,19,3434 3485","593 18 07 01",NULL,NULL
3486,54,5,"CHIQUICHA (CAB. EN CHIQUICHA GRANDE)",3434,"ECUADOR TUNGURAHUA SAN PEDRO DE PELILEO CHIQUICHA (CAB. EN CHIQUICHA GRANDE)","1,19,3434 3486","593 18 07 54",NULL,NULL
3487,55,5,"EL ROSARIO (RUMICHACA)",3434,"ECUADOR TUNGURAHUA SAN PEDRO DE PELILEO EL ROSARIO (RUMICHACA)","1,19,3434 3487","593 18 07 55",NULL,NULL
3488,57,5,"GUAMBALÓ (HUAMBALÓ)",3434,"ECUADOR TUNGURAHUA SAN PEDRO DE PELILEO GUAMBALÓ (HUAMBALÓ)","1,19,3434 3488","593 18 07 57",NULL,NULL
3489,56,5,"GARCÍA MORENO (CHUMAQUI)",3434,"ECUADOR TUNGURAHUA SAN PEDRO DE PELILEO GARCÍA MORENO (CHUMAQUI)","1,19,3434 3489","593 18 07 56",NULL,NULL
3490,58,5,SALASACA,3434,"ECUADOR TUNGURAHUA SAN PEDRO DE PELILEO SALASACA","1,19,3434 3490","593 18 07 58",NULL,NULL
3491,50,8,"PÍLLARO, CABECERA CANTONAL",3435,"ECUADOR TUNGURAHUA SANTIAGO DE PÍLLARO PÍLLARO, CABECERA CANTONAL","1,19,3435 3491","593 18 08 50",NULL,NULL
3492,01,4,"CIUDAD NUEVA",3435,"ECUADOR TUNGURAHUA SANTIAGO DE PÍLLARO CIUDAD NUEVA","1,19,3435 3492","593 18 08 01",NULL,NULL
3493,53,5,"MARCOS ESPINEL (CHACATA) ",3435,"ECUADOR TUNGURAHUA SANTIAGO DE PÍLLARO MARCOS ESPINEL (CHACATA) ","1,19,3435 3493","593 18 08 53",NULL,NULL
3494,51,5,"BAQUERIZO MORENO",3435,"ECUADOR TUNGURAHUA SANTIAGO DE PÍLLARO BAQUERIZO MORENO","1,19,3435 3494","593 18 08 51",NULL,NULL
3495,52,5,"EMILIO MARÍA TERÁN (RUMIPAMBA)",3435,"ECUADOR TUNGURAHUA SANTIAGO DE PÍLLARO EMILIO MARÍA TERÁN (RUMIPAMBA)","1,19,3435 3495","593 18 08 52",NULL,NULL
3496,02,4,PÍLLARO,3435,"ECUADOR TUNGURAHUA SANTIAGO DE PÍLLARO PÍLLARO","1,19,3435 3496","593 18 08 02",NULL,NULL
3497,54,5,"PRESIDENTE URBINA (CHAGRAPAMBA -PATZUCUL)	",3435,"ECUADOR TUNGURAHUA SANTIAGO DE PÍLLARO PRESIDENTE URBINA (CHAGRAPAMBA -PATZUCUL)	","1,19,3435 3497","593 18 08 54",NULL,NULL
3498,55,5,"SAN ANDRÉS",3435,"ECUADOR TUNGURAHUA SANTIAGO DE PÍLLARO SAN ANDRÉS","1,19,3435 3498","593 18 08 55",NULL,NULL
3499,56,5,"SAN JOSÉ DE POALÓ",3435,"ECUADOR TUNGURAHUA SANTIAGO DE PÍLLARO SAN JOSÉ DE POALÓ","1,19,3435 3499","593 18 08 56",NULL,NULL
3500,57,5,"SAN MIGUELITO",3435,"ECUADOR TUNGURAHUA SANTIAGO DE PÍLLARO SAN MIGUELITO","1,19,3435 3500","593 18 08 57",NULL,NULL
3501,50,8,"TISALEO, CABECERA CANTONAL",3436,"ECUADOR TUNGURAHUA TISALEO TISALEO, CABECERA CANTONAL","1,19,3436 3501","593 18 09 50",NULL,NULL
3502,51,5,QUINCHICOTO,3436,"ECUADOR TUNGURAHUA TISALEO QUINCHICOTO","1,19,3436 3502","593 18 09 51",NULL,NULL
3503,01,3,ZAMORA,20,"ECUADOR ZAMORA CHINCHIPE ZAMORA","1,20,3503","593 19 01",NULL,NULL
3504,02,3,CHINCHIPE,20,"ECUADOR ZAMORA CHINCHIPE CHINCHIPE","1,20,3504","593 19 02",NULL,NULL
3505,03,3,NANGARITZA,20,"ECUADOR ZAMORA CHINCHIPE NANGARITZA","1,20,3505","593 19 03",NULL,NULL
3506,04,3,YACUAMBÍ,20,"ECUADOR ZAMORA CHINCHIPE YACUAMBÍ","1,20,3506","593 19 04",NULL,NULL
3507,05,3,YANTZAZA,20,"ECUADOR ZAMORA CHINCHIPE YANTZAZA","1,20,3507","593 19 05",NULL,NULL
3508,06,3,"EL PANGUI",20,"ECUADOR ZAMORA CHINCHIPE EL PANGUI","1,20,3508","593 19 06",NULL,NULL
3509,07,3,"CENTINELA DEL CÓNDOR",20,"ECUADOR ZAMORA CHINCHIPE CENTINELA DEL CÓNDOR","1,20,3509","593 19 07",NULL,NULL
3510,08,3,PALANDA,20,"ECUADOR ZAMORA CHINCHIPE PALANDA","1,20,3510","593 19 08",NULL,NULL
3511,09,3,PAQUISHA,20,"ECUADOR ZAMORA CHINCHIPE PAQUISHA","1,20,3511","593 19 09",NULL,NULL
3512,02,4,ZAMORA,3503,"ECUADOR ZAMORA CHINCHIPE ZAMORA ZAMORA","1,20,3503 3512","593 19 01 02",NULL,NULL
3513,01,4,"EL LIMÓN",3503,"ECUADOR ZAMORA CHINCHIPE ZAMORA EL LIMÓN","1,20,3503 3513","593 19 01 01",NULL,NULL
3514,56,5,TIMBARA,3503,"ECUADOR ZAMORA CHINCHIPE ZAMORA TIMBARA","1,20,3503 3514","593 19 01 56",NULL,NULL
3515,58,5,"SAN CARLOS DE LAS MINAS",3503,"ECUADOR ZAMORA CHINCHIPE ZAMORA SAN CARLOS DE LAS MINAS","1,20,3503 3515","593 19 01 58",NULL,NULL
3516,55,5,SABANILLA,3503,"ECUADOR ZAMORA CHINCHIPE ZAMORA SABANILLA","1,20,3503 3516","593 19 01 55",NULL,NULL
3517,53,5,"IMBANA (LA VICTORIA DE IMBANA)",3503,"ECUADOR ZAMORA CHINCHIPE ZAMORA IMBANA (LA VICTORIA DE IMBANA)","1,20,3503 3517","593 19 01 53",NULL,NULL
3518,50,8,"ZAMORA, CABECERA CANTONAL Y CAPITAL PROVINCIAL				",3503,"ECUADOR ZAMORA CHINCHIPE ZAMORA ZAMORA, CABECERA CANTONAL Y CAPITAL PROVINCIAL				","1,20,3503 3518","593 19 01 50",NULL,NULL
3519,51,5,CUMBARATZA,3503,"ECUADOR ZAMORA CHINCHIPE ZAMORA CUMBARATZA","1,20,3503 3519","593 19 01 51",NULL,NULL
3520,52,5,GUADALUPE,3503,"ECUADOR ZAMORA CHINCHIPE ZAMORA GUADALUPE","1,20,3503 3520","593 19 01 52",NULL,NULL
3521,50,8,"ZUMBA, CABECERA CANTONAL",3504,"ECUADOR ZAMORA CHINCHIPE CHINCHIPE ZUMBA, CABECERA CANTONAL","1,20,3504,3521","593 19 02 50",NULL,NULL
3522,54,5,"LA CHONTA",3504,"ECUADOR ZAMORA CHINCHIPE CHINCHIPE LA CHONTA","1,20,3504,3522","593 19 02 54",NULL,NULL
3523,56,5,PUCAPAMBA,3504,"ECUADOR ZAMORA CHINCHIPE CHINCHIPE PUCAPAMBA","1,20,3504,3523","593 19 02 56",NULL,NULL
3524,59,5,"SAN ANDRÉS",3504,"ECUADOR ZAMORA CHINCHIPE CHINCHIPE SAN ANDRÉS","1,20,3504,3524","593 19 02 59",NULL,NULL
3525,52,5,"EL CHORRO",3504,"ECUADOR ZAMORA CHINCHIPE CHINCHIPE EL CHORRO","1,20,3504,3525","593 19 02 52",NULL,NULL
3526,51,5,CHITO,3504,"ECUADOR ZAMORA CHINCHIPE CHINCHIPE CHITO","1,20,3504,3526","593 19 02 51",NULL,NULL
3527,50,8,"GUAYZIMI, CABECERA CANTONAL",3505,"ECUADOR ZAMORA CHINCHIPE NANGARITZA GUAYZIMI, CABECERA CANTONAL","1,20,3505 3527","593 19 03 50",NULL,NULL
3528,52,5,"NUEVO PARAÍSO",3505,"ECUADOR ZAMORA CHINCHIPE NANGARITZA NUEVO PARAÍSO","1,20,3505 3528","593 19 03 52",NULL,NULL
3529,51,5,ZURMI,3505,"ECUADOR ZAMORA CHINCHIPE NANGARITZA ZURMI","1,20,3505 3529","593 19 03 51",NULL,NULL
3530,50,8,"28 DE MAYO (SAN JOSÉ DE YACUAMBI), CABECERA CANTONAL				",3506,"ECUADOR ZAMORA CHINCHIPE YACUAMBÍ 28 DE MAYO (SAN JOSÉ DE YACUAMBI), CABECERA CANTONAL","1,20,3506 3530","593 19 04 50",NULL,NULL
3531,51,5,"LA PAZ",3506,"ECUADOR ZAMORA CHINCHIPE YACUAMBÍ LA PAZ","1,20,3506 3531","593 19 04 51",NULL,NULL
3532,52,5,TUTUPALI,3506,"ECUADOR ZAMORA CHINCHIPE YACUAMBÍ TUTUPALI","1,20,3506 3532","593 19 04 52",NULL,NULL
3533,50,8,"YANTZAZA (YANZATZA), CABECERA CANTONAL	",3507,"ECUADOR ZAMORA CHINCHIPE YANTZAZA YANTZAZA (YANZATZA), CABECERA CANTONAL	","1,20,3507 3533","593 19 05 50",NULL,NULL
3534,51,5,CHICAÑA,3507,"ECUADOR ZAMORA CHINCHIPE YANTZAZA CHICAÑA","1,20,3507 3534","593 19 05 51",NULL,NULL
3535,53,5,"LOS ENCUENTROS",3507,"ECUADOR ZAMORA CHINCHIPE YANTZAZA LOS ENCUENTROS","1,20,3507 3535","593 19 05 53",NULL,NULL
3536,50,8,"EL PANGUI, CABECERA CANTONAL",3508,"ECUADOR ZAMORA CHINCHIPE EL PANGUI EL PANGUI, CABECERA CANTONAL","1,20,3508 3536","593 19 06 50",NULL,NULL
3537,51,5,"EL GUISME ",3508,"ECUADOR ZAMORA CHINCHIPE EL PANGUI EL GUISME ","1,20,3508 3537","593 19 06 51",NULL,NULL
3538,52,5,PACHICUTZA,3508,"ECUADOR ZAMORA CHINCHIPE EL PANGUI PACHICUTZA","1,20,3508 3538","593 19 06 52",NULL,NULL
3539,53,5,TUNDAYME,3508,"ECUADOR ZAMORA CHINCHIPE EL PANGUI TUNDAYME","1,20,3508 3539","593 19 06 53",NULL,NULL
3540,50,8,"ZUMBI, CABECERA CANTONAL",3509,"ECUADOR ZAMORA CHINCHIPE CENTINELA DEL CÓNDOR ZUMBI, CABECERA CANTONAL","1,20,3509 3540","593 19 07 50",NULL,NULL
3541,53,5,PANGUINTZA,3509,"ECUADOR ZAMORA CHINCHIPE CENTINELA DEL CÓNDOR PANGUINTZA","1,20,3509 3541","593 19 07 53",NULL,NULL
3542,52,5,TRIUNFO-DORADO,3509,"ECUADOR ZAMORA CHINCHIPE CENTINELA DEL CÓNDOR TRIUNFO-DORADO","1,20,3509 3542","593 19 07 52",NULL,NULL
3543,50,8,"PALANDA, CABECERA CANTONAL",3510,"ECUADOR ZAMORA CHINCHIPE PALANDA PALANDA, CABECERA CANTONAL","1,20,3510 3543","593 19 08 50",NULL,NULL
3544,52,5,"SAN FRANCISCO DEL VERGEL",3510,"ECUADOR ZAMORA CHINCHIPE PALANDA SAN FRANCISCO DEL VERGEL","1,20,3510 3544","593 19 08 52",NULL,NULL
3545,51,5,"EL PORVENIR DEL CARMEN",3510,"ECUADOR ZAMORA CHINCHIPE PALANDA EL PORVENIR DEL CARMEN","1,20,3510 3545","593 19 08 51",NULL,NULL
3546,54,5,"LA CANELA",3510,"ECUADOR ZAMORA CHINCHIPE PALANDA LA CANELA","1,20,3510 3546","593 19 08 54",NULL,NULL
3547,53,5,VALLADOLID,3510,"ECUADOR ZAMORA CHINCHIPE PALANDA VALLADOLID","1,20,3510 3547","593 19 08 53",NULL,NULL
3548,50,8,"PAQUISHA, CABECERA CANTONAL",3511,"ECUADOR ZAMORA CHINCHIPE PAQUISHA PAQUISHA, CABECERA CANTONAL","1,20,3511 3548","593 19 09 50",NULL,NULL
3549,52,5,"NUEVO QUITO",3511,"ECUADOR ZAMORA CHINCHIPE PAQUISHA NUEVO QUITO","1,20,3511 3549","593 19 09 52",NULL,NULL
3550,51,5,BELLAVISTA,3511,"ECUADOR ZAMORA CHINCHIPE PAQUISHA BELLAVISTA","1,20,3511 3550","593 19 09 51",NULL,NULL
3551,01,3,"SAN CRISTÓBAL",21,"ECUADOR GALAPAGOS SAN CRISTÓBAL","1,21,3551","593 20 01",NULL,NULL
3552,02,3,ISABELA,21,"ECUADOR GALAPAGOS ISABELA","1,21,3552","593 20 02",NULL,NULL
3553,03,3,"SANTA CRUZ",21,"ECUADOR GALAPAGOS SANTA CRUZ","1,21,3553","593 20 03",NULL,NULL
3554,50,8,"PUERTO BAQUERIZO MORENO, CABECERA CANTONAL Y CAPITAL PROVINCIAL				",3551,"ECUADOR GALAPAGOS SAN CRISTÓBAL PUERTO BAQUERIZO MORENO, CABECERA CANTONAL Y CAPITAL PROVINCIAL","1,21,3551,3554","593 20 01 50",NULL,NULL
3555,52,5,"ISLA SANTA MARÍA (FLOREANA) (CAB. EN  PTO. VELASCO IBARRA)",3551,"ECUADOR GALAPAGOS SAN CRISTÓBAL ISLA SANTA MARÍA (FLOREANA) (CAB. EN  PTO. VELASCO IBARRA)","1,21,3551,3555","593 20 01 52",NULL,NULL
3556,51,5,"EL PROGRESO",3551,"ECUADOR GALAPAGOS SAN CRISTÓBAL EL PROGRESO","1,21,3551,3556","593 20 01 51",NULL,NULL
3557,50,8,"PUERTO VILLAMIL, CABECERA CANTONAL",3552,"ECUADOR GALAPAGOS ISABELA PUERTO VILLAMIL, CABECERA CANTONAL","1,21,3552,3557","593 20 02 50",NULL,NULL
3558,51,5,"TOMÁS DE BERLANGA (SANTO TOMÁS)",3552,"ECUADOR GALAPAGOS ISABELA TOMÁS DE BERLANGA (SANTO TOMÁS)","1,21,3552,3558","593 20 02 51",NULL,NULL
3559,50,8,"PUERTO AYORA, CABECERA CANTONAL",3553,"ECUADOR GALAPAGOS SANTA CRUZ PUERTO AYORA, CABECERA CANTONAL","1,21,3553,3559","593 20 03 50",NULL,NULL
3560,52,5,"SANTA ROSA (INCLUYE LA ISLA BALTRA)",3553,"ECUADOR GALAPAGOS SANTA CRUZ SANTA ROSA (INCLUYE LA ISLA BALTRA)","1,21,3553,3560","593 20 03 52",NULL,NULL
3561,51,5,BELLAVISTA,3553,"ECUADOR GALAPAGOS SANTA CRUZ BELLAVISTA","1,21,3553,3561","593 20 03 51",NULL,NULL
3562,02,3,"GONZALO PIZARRO",22,"ECUADOR SUCUMBIOS GONZALO PIZARRO","1,22,3562","593 21 02",NULL,NULL
3563,01,3,"LAGO AGRIO",22,"ECUADOR SUCUMBIOS LAGO AGRIO","1,22,3563","593 21 01",NULL,NULL
3564,03,3,PUTUMAYO,22,"ECUADOR SUCUMBIOS PUTUMAYO","1,22,3564","593 21 03",NULL,NULL
3565,04,3,SHUSHUFINDI,22,"ECUADOR SUCUMBIOS SHUSHUFINDI","1,22,3565","593 21 04",NULL,NULL
3566,05,3,SUCUMBÍOS,22,"ECUADOR SUCUMBIOS SUCUMBÍOS","1,22,3566","593 21 05",NULL,NULL
3567,06,3,CASCALES,22,"ECUADOR SUCUMBIOS CASCALES","1,22,3567","593 21 06",NULL,NULL
3568,07,3,CUYABENO,22,"ECUADOR SUCUMBIOS CUYABENO","1,22,3568","593 21 07",NULL,NULL
3569,56,5,PACAYACU,3563,"ECUADOR SUCUMBIOS LAGO AGRIO PACAYACU","1,22,3563 3569","593 21 01 56",NULL,NULL
3570,50,8,"NUEVA LOJA, CABECERA CANTONAL Y CAPITAL PROVINCIAL				",3563,"ECUADOR SUCUMBIOS LAGO AGRIO NUEVA LOJA, CABECERA CANTONAL Y CAPITAL PROVINCIAL				","1,22,3563 3570","593 21 01 50",NULL,NULL
3571,53,5,"GENERAL FARFÁN",3563,"ECUADOR SUCUMBIOS LAGO AGRIO GENERAL FARFÁN","1,22,3563 3571","593 21 01 53",NULL,NULL
3572,55,5,"EL ENO",3563,"ECUADOR SUCUMBIOS LAGO AGRIO EL ENO","1,22,3563 3572","593 21 01 55",NULL,NULL
3573,52,5,DURENO,3563,"ECUADOR SUCUMBIOS LAGO AGRIO DURENO","1,22,3563 3573","593 21 01 52",NULL,NULL
3574,57,5,JAMBELÍ,3563,"ECUADOR SUCUMBIOS LAGO AGRIO JAMBELÍ","1,22,3563 3574","593 21 01 57",NULL,NULL
3575,60,5,"10 DE AGOSTO",3563,"ECUADOR SUCUMBIOS LAGO AGRIO 10 DE AGOSTO","1,22,3563 3575","593 21 01 60",NULL,NULL
3576,58,5,"SANTA CECILIA",3563,"ECUADOR SUCUMBIOS LAGO AGRIO SANTA CECILIA","1,22,3563 3576","593 21 01 58",NULL,NULL
3577,50,8,"LUMBAQUÍ, CABECERA CANTONAL",3562,"ECUADOR SUCUMBIOS GONZALO PIZARRO LUMBAQUÍ, CABECERA CANTONAL","1,22,3562 3577","593 21 02 50",NULL,NULL
3578,52,5,"GONZALO PIZARRO ",3562,"ECUADOR SUCUMBIOS GONZALO PIZARRO GONZALO PIZARRO ","1,22,3562 3578","593 21 02 52",NULL,NULL
3579,51,5,"EL REVENTADOR   ",3562,"ECUADOR SUCUMBIOS GONZALO PIZARRO EL REVENTADOR   ","1,22,3562 3579","593 21 02 51",NULL,NULL
3580,54,5,"PUERTO LIBRE",3562,"ECUADOR SUCUMBIOS GONZALO PIZARRO PUERTO LIBRE","1,22,3562 3580","593 21 02 54",NULL,NULL
3581,50,8,"PUERTO EL CARMEN DEL PUTUMAYO, CABECERA CANTONAL				",3564,"ECUADOR SUCUMBIOS PUTUMAYO PUERTO EL CARMEN DEL PUTUMAYO, CABECERA CANTONAL				","1,22,3564 3581","593 21 03 50",NULL,NULL
3582,52,5,"PUERTO BOLÍVAR (PUERTO MONTÚFAR)",3564,"ECUADOR SUCUMBIOS PUTUMAYO PUERTO BOLÍVAR (PUERTO MONTÚFAR)","1,22,3564 3582","593 21 03 52",NULL,NULL
3583,53,5,"PUERTO RODRÍGUEZ",3564,"ECUADOR SUCUMBIOS PUTUMAYO PUERTO RODRÍGUEZ","1,22,3564 3583","593 21 03 53",NULL,NULL
3584,51,5,"PALMA ROJA",3564,"ECUADOR SUCUMBIOS PUTUMAYO PALMA ROJA","1,22,3564 3584","593 21 03 51",NULL,NULL
3585,54,5,"SANTA ELENA",3564,"ECUADOR SUCUMBIOS PUTUMAYO SANTA ELENA","1,22,3564 3585","593 21 03 54",NULL,NULL
3586,50,8,"SHUSHUFINDI, CABECERA CANTONAL",3565,"ECUADOR SUCUMBIOS SHUSHUFINDI SHUSHUFINDI, CABECERA CANTONAL","1,22,3565 3586","593 21 04 50",NULL,NULL
3587,51,5,LIMONCOCHA,3565,"ECUADOR SUCUMBIOS SHUSHUFINDI LIMONCOCHA","1,22,3565 3587","593 21 04 51",NULL,NULL
3588,52,5,PAÑACOCHA,3565,"ECUADOR SUCUMBIOS SHUSHUFINDI PAÑACOCHA","1,22,3565 3588","593 21 04 52",NULL,NULL
3589,53,5,"SAN ROQUE (CAB. EN SAN VICENTE)",3565,"ECUADOR SUCUMBIOS SHUSHUFINDI SAN ROQUE (CAB. EN SAN VICENTE)","1,22,3565 3589","593 21 04 53",NULL,NULL
3590,54,5,"SAN PEDRO DE LOS COFANES",3565,"ECUADOR SUCUMBIOS SHUSHUFINDI SAN PEDRO DE LOS COFANES","1,22,3565 3590","593 21 04 54",NULL,NULL
3591,55,5,"SIETE DE JULIO",3565,"ECUADOR SUCUMBIOS SHUSHUFINDI SIETE DE JULIO","1,22,3565 3591","593 21 04 55",NULL,NULL
3592,54,5,"SANTA BÁRBARA",3566,"ECUADOR SUCUMBIOS SUCUMBÍOS SANTA BÁRBARA","1,22,3566 3592","593 21 05 54",NULL,NULL
3593,50,8,"LA BONITA, CABECERA CANTONAL",3566,"ECUADOR SUCUMBIOS SUCUMBÍOS LA BONITA, CABECERA CANTONAL","1,22,3566 3593","593 21 05 50",NULL,NULL
3594,53,5,"ROSA FLORIDA",3566,"ECUADOR SUCUMBIOS SUCUMBÍOS ROSA FLORIDA","1,22,3566 3594","593 21 05 53",NULL,NULL
3595,52,5,"LA SOFÍA",3566,"ECUADOR SUCUMBIOS SUCUMBÍOS LA SOFÍA","1,22,3566 3595","593 21 05 52",NULL,NULL
3596,51,5,"EL PLAYÓN DE SAN FRANCISCO",3566,"ECUADOR SUCUMBIOS SUCUMBÍOS EL PLAYÓN DE SAN FRANCISCO","1,22,3566 3596","593 21 05 51",NULL,NULL
3597,51,5,"SANTA ROSA DE SUCUMBÍOS",3567,"ECUADOR SUCUMBIOS CASCALES SANTA ROSA DE SUCUMBÍOS","1,22,3567 3597","593 21 06 51",NULL,NULL
3598,52,5,SEVILLA,3567,"ECUADOR SUCUMBIOS CASCALES SEVILLA","1,22,3567 3598","593 21 06 52",NULL,NULL
3599,50,8,"EL DORADO DE CASCALES, CABECERA CANTONAL			",3567,"ECUADOR SUCUMBIOS CASCALES EL DORADO DE CASCALES, CABECERA CANTONAL			","1,22,3567 3599","593 21 06 50",NULL,NULL
3600,50,8,"TARAPOA , CABECERA CANTONAL",3568,"ECUADOR SUCUMBIOS CUYABENO TARAPOA , CABECERA CANTONAL","1,22,3568 3600","593 21 07 50",NULL,NULL
3601,51,5,CUYABENO,3568,"ECUADOR SUCUMBIOS CUYABENO CUYABENO","1,22,3568 3601","593 21 07 51",NULL,NULL
3602,52,5,"AGUAS NEGRAS",3568,"ECUADOR SUCUMBIOS CUYABENO AGUAS NEGRAS","1,22,3568 3602","593 21 07 52",NULL,NULL
